id,collection,dc.contributor.author[],dc.date.accessioned,dc.date.accessioned[],dc.date.available,dc.date.available[],dc.date.issued[],dc.description.abstract[en_US],dc.description.provenance[en],dc.identifier.citation[en_US],dc.identifier.uri,dc.identifier.uri[],dc.language.iso[en_US],dc.publisher[en_US],dc.title[en_US],dc.type[en_US]
"83cd733d-eb26-45a7-854d-6b99d659c179","1/1765","Kohen-Vacs, Dan||Ronen, Miky||Cohen, Shavit","2020-01-08T18:52:15Z","2019-07-20T19:49:47Z","2020-01-08T18:52:15Z","2019-07-20T19:49:47Z","2013-06","Treasure-HIT is an environment that aims to support the design and enactment of location based games conducted via mobile phones. The system allows teachers to define a set of locations (using Google Maps and Google Street APIs), to attach clues that direct the players to the locations and to conduct specific activities at each location. The system will be tested with teachers designing outdoor learning activities for the subject My Village as part of the national curriculum for elementary schools. In the poster session we shall demonstrate the functionalities and potential of the system for designing outdoor collaborative activities, present examples of games designed by teachers and discuss insights gained from the pilot study with teachers and students.","Made available in DSpace on 2020-01-08T18:52:15Z (GMT). No. of bitstreams: 1
295-296.pdf: 193585 bytes, checksum: 9fc83b19982cf308185d3569aa4d9eda (MD5)
  Previous issue date: 2013-06","Kohen-Vacs, D., Ronen, M., & Cohen, S. (2013). Treasure-HIT: Supporting Outdoor Collaborative Activities with Mobile Treasure Hunt Games. In Rummel, N., Kapur, M., Nathan, M., & Puntambekar, S. (Eds.), To See the World and a Grain of Sand: Learning across Levels of Space, Time, and Scale: CSCL 2013 Conference Proceedings Volume 2 — Short Papers, Panels, Posters, Demos & Community Events (pp. 295-296). Madison, WI: International Society of the Learning Sciences.","https://repository.isls.org//handle/1/1868","https://doi.dx.org/10.22318/cscl2013.2.295","en","International Society of the Learning Sciences","Treasure-HIT: Supporting Outdoor Collaborative Activities with Mobile Treasure Hunt Games","Poster Papers"
"234b5c5f-d853-4ff8-a7ab-12864a216709","1/1765","Loibl, Katharina||Rummel, Nikol","2020-01-08T18:52:15Z","2019-05-22T09:50:58Z","2020-01-08T18:52:15Z","2019-05-22T09:50:58Z","2013-06","Recent studies have shown benefits of problem-solving prior to instruction. However, it is unclear whether these benefits are based on the cognitive processes related to the problem-solving activity prior to instruction or originate from comparing and contrasting students' solutions to the canonical solution during subsequent instruction. To separate these effects, we conducted a quasi-experimental study with 240 students varying the two factors timing of instruction (problem-solving prior to instruction versus instruction prior to problem- solving) and form of instruction (standard instruction versus instruction that compares and contrasts typical student solutions). Our results indicate that comparing and contrasting typical student solutions is a prerequisite for the effectiveness of problem-solving prior to instruction. Problem-solving prior to instruction combined with instruction where student solutions were compared and contrasted to the canonical solution outperformed all other conditions. Problem-solving prior to standard instruction was no more effective than standard instruction prior to problem-solving.","Made available in DSpace on 2020-01-08T18:52:15Z (GMT). No. of bitstreams: 1
296-303.pdf: 207959 bytes, checksum: 0e35fbdfd670a86975c98155a5362690 (MD5)
  Previous issue date: 2013-06","Loibl, K. & Rummel, N. (2013). Delaying Instruction Alone Doesn't Work: Comparing and Contrasting Student Solutions is Necessary for Learning from Problem-Solving Prior to Instruction. In Rummel, N., Kapur, M., Nathan, M., & Puntambekar, S. (Eds.), To See the World and a Grain of Sand: Learning across Levels of Space, Time, and Scale: CSCL 2013 Conference Proceedings Volume 1 — Full Papers & Symposia (pp. 296-303). Madison, WI: International Society of the Learning Sciences.","https://repository.isls.org//handle/1/1869","https://doi.dx.org/10.22318/cscl2013.1.296","en","International Society of the Learning Sciences","Delaying Instruction Alone Doesn't Work: Comparing and Contrasting Student Solutions is Necessary for Learning from Problem-Solving Prior to Instruction","Full Papers"
"dc0d8969-10c9-4fcd-aadc-38d8f712e514","1/1765","Kopp, Birgitta||Mandl, Heinz","2020-01-08T18:52:15Z","2019-07-20T19:49:47Z","2020-01-08T18:52:15Z","2019-07-20T19:49:47Z","2013-06","This pilot field study investigated the evaluation of virtual collaboration and of support methods over time asking 32 undergraduates studying pedagogy with a survey questionnaire at three points of time. Results indicate a specific evaluation pattern showing that at all three points of time, taking responsibility was evaluated lowest. Furthermore, correlation analyses showed that the support of designing group work was connected significantly with taking responsibility indicating a positive influence for supporting virtual collaboration.","Made available in DSpace on 2020-01-08T18:52:15Z (GMT). No. of bitstreams: 1
297-298.pdf: 112439 bytes, checksum: bd61e7bde444539866b13ee854875472 (MD5)
  Previous issue date: 2013-06","Kopp, B. & Mandl, H. (2013). Evaluating Virtual Collaboration Over Time - A Pilot Field Study. In Rummel, N., Kapur, M., Nathan, M., & Puntambekar, S. (Eds.), To See the World and a Grain of Sand: Learning across Levels of Space, Time, and Scale: CSCL 2013 Conference Proceedings Volume 2 — Short Papers, Panels, Posters, Demos & Community Events (pp. 297-298). Madison, WI: International Society of the Learning Sciences.","https://repository.isls.org//handle/1/1870","https://doi.dx.org/10.22318/cscl2013.2.297","en","International Society of the Learning Sciences","Evaluating Virtual Collaboration Over Time - A Pilot Field Study","Poster Papers"
"9931d089-98f8-4c06-9e34-5432527a023c","1/1765","Laffey, James M.||Stichter, Janine||Galyen, Krista||Wang, Xianhui||Ding, Nan||Babiuch, Ryan||Griffin, Joe","2020-01-08T18:52:16Z","2019-07-20T19:49:48Z","2020-01-08T18:52:16Z","2019-07-20T19:49:48Z","2013-06","iSocial is an innovative 3D Collaborative Virtual Learning Environment (3D CVLE) to provide access to educational programming for students with special needs who live in small and rural school districts. The research reported here is part of a design research process for developing virtual learning systems to improve learning for students with special needs who live in rural/small districts. A field test of iSocial with 11 students shows promise, but also identifies challenges for distance education with 3D collaborative virtual learning.","Made available in DSpace on 2020-01-08T18:52:16Z (GMT). No. of bitstreams: 1
299-300.pdf: 114110 bytes, checksum: 5bc34cb4f3d4c61c975c3374a5eebafa (MD5)
  Previous issue date: 2013-06","Laffey, J. M., Stichter, J., Galyen, K., Wang, X., Ding, N., Babiuch, R., & Griffin, J. (2013). iSocial: Collaborative Distance Education for Special Needs. In Rummel, N., Kapur, M., Nathan, M., & Puntambekar, S. (Eds.), To See the World and a Grain of Sand: Learning across Levels of Space, Time, and Scale: CSCL 2013 Conference Proceedings Volume 2 — Short Papers, Panels, Posters, Demos & Community Events (pp. 299-300). Madison, WI: International Society of the Learning Sciences.","https://repository.isls.org//handle/1/1871","https://doi.dx.org/10.22318/cscl2013.2.299","en","International Society of the Learning Sciences","iSocial: Collaborative Distance Education for Special Needs","Poster Papers"
"59a2485e-b6d6-4bf7-9e4f-ff7903a7db66","1/1765","Fu, Ella L.F.||van Aalst, Jan||Chan, Carol K.K.","2020-01-08T18:52:16Z","2019-07-20T19:49:04Z","2020-01-08T18:52:16Z","2019-07-20T19:49:04Z","2013-06","We report an exploratory study of discourse analysis, focusing on explaining the analytic approach. It is argued that most knowledge-building studies have taken a cognitively- oriented approach to examine collaborative discourse; therefore their findings do not shed light on how idea improvement is accomplished socially. The study employs thematic narrative analysis to address how idea improvement comes about. The paper ends with a discussion of the value of this approach.","Made available in DSpace on 2020-01-08T18:52:16Z (GMT). No. of bitstreams: 1
30-33.pdf: 166766 bytes, checksum: 80643b64c2fa0a8aff53263830e4a0a6 (MD5)
  Previous issue date: 2013-06","Fu, E. L., van Aalst, J., & Chan, C. K. (2013). Toward a Qualitative Approach to Examining Idea Improvement in Knowledgebuilding Discourse. In Rummel, N., Kapur, M., Nathan, M., & Puntambekar, S. (Eds.), To See the World and a Grain of Sand: Learning across Levels of Space, Time, and Scale: CSCL 2013 Conference Proceedings Volume 2 — Short Papers, Panels, Posters, Demos & Community Events (pp. 30-33). Madison, WI: International Society of the Learning Sciences.","https://repository.isls.org//handle/1/1872","https://doi.dx.org/10.22318/cscl2013.2.30","en","International Society of the Learning Sciences","Toward a Qualitative Approach to Examining Idea Improvement in Knowledgebuilding Discourse","Short Papers"
"15299bda-a429-41d1-9907-b95d21180732","1/1765","Li, Pei-Jung||Chang, Chih-Hsuan||Hong, Huang-Yao","2020-01-08T18:52:16Z","2019-07-20T19:49:48Z","2020-01-08T18:52:16Z","2019-07-20T19:49:48Z","2013-06","This study explored the impact of online collaborative learning on students' understanding of the nature of scientific theory. The participants consist of 52 college students who attended a course titled ""Introduction to Nature Science"". Data sources came from (1) a pre-post survey that assesses students' understanding of the nature of scientific theory, and (2) students' online interactions. Findings indicate that after engaging in online collaborative learning for a semester, students demonstrated a more informed understanding of the nature of scientific theory.","Made available in DSpace on 2020-01-08T18:52:16Z (GMT). No. of bitstreams: 1
301-302.pdf: 119583 bytes, checksum: a807bd585be04961a31a465d5f6ad08a (MD5)
  Previous issue date: 2013-06","Li, P., Chang, C., & Hong, H. (2013). Exploring the Effect of Online Collaborative Learning on Students' Scientific Understanding. In Rummel, N., Kapur, M., Nathan, M., & Puntambekar, S. (Eds.), To See the World and a Grain of Sand: Learning across Levels of Space, Time, and Scale: CSCL 2013 Conference Proceedings Volume 2 — Short Papers, Panels, Posters, Demos & Community Events (pp. 301-302). Madison, WI: International Society of the Learning Sciences.","https://repository.isls.org//handle/1/1873","https://doi.dx.org/10.22318/cscl2013.2.301","en","International Society of the Learning Sciences","Exploring the Effect of Online Collaborative Learning on Students' Scientific Understanding","Poster Papers"
"484e1298-30b7-45b2-917c-43e5a7f6226c","1/1765","Liu, Shiyu","2020-01-08T18:52:17Z","2019-07-20T19:49:49Z","2020-01-08T18:52:17Z","2019-07-20T19:49:49Z","2013-06","The present study investigates effective approaches to facilitate college students' self-regulated learning. Moodle forums were employed as a platform for students to develop metacognitive skills in the learning of psychology, and digital concept mapping was used to measure their conceptual knowledge. The findings suggest that discussions on Moodle forums enhanced students' awareness of their learning processes and facilitated the development of metacognitive skills. Active participation in such discussions promoted knowledge construction in concept mapping.","Made available in DSpace on 2020-01-08T18:52:17Z (GMT). No. of bitstreams: 1
303-304.pdf: 151303 bytes, checksum: caa4ced0e2d2c0d1c784e7239f1aa9b8 (MD5)
  Previous issue date: 2013-06","Liu, S. (2013). Supporting Self-regulated Learning with Moodle Forums. In Rummel, N., Kapur, M., Nathan, M., & Puntambekar, S. (Eds.), To See the World and a Grain of Sand: Learning across Levels of Space, Time, and Scale: CSCL 2013 Conference Proceedings Volume 2 — Short Papers, Panels, Posters, Demos & Community Events (pp. 303-304). Madison, WI: International Society of the Learning Sciences.","https://repository.isls.org//handle/1/1874","https://doi.dx.org/10.22318/cscl2013.2.303","en","International Society of the Learning Sciences","Supporting Self-regulated Learning with Moodle Forums","Poster Papers"
"d72fd7b4-3b4f-4f3b-a6b1-1ac2cbf95a6a","1/1765","Lui, Michelle||Slotta, James D.","2020-01-08T18:52:17Z","2019-05-22T09:50:59Z","2020-01-08T18:52:17Z","2019-05-22T09:50:59Z","2013-06","This paper presents two iterations of our design of an immersive simulation and inquiry activity for exploring evolutionary concepts in a Grade 11 Biology course. Interacting with large projected displays of animated rainforest flora and fauna, students worked as ""field researchers"" to observe changes in life forms occurring over a 200 million year span. Students gathered evidence of evolution using networked tablet computers that scaffolded their interactions with peers and with the room itself. Improvements from the first to the second design iteration focused on (1) improving content-focused interactions within the simulation; (2) improving the integration of the simulation activity into the overall curriculum; (3) improving embodied interactions of students working within the physical space. Student explanations from the second implementation demonstrated increased variation in evolutionary topics compared to those in the first iteration. Key design features from the two iterations are discussed with respect to the observed interaction patterns.","Made available in DSpace on 2020-01-08T18:52:17Z (GMT). No. of bitstreams: 1
304-311.pdf: 641562 bytes, checksum: 3cc38618880f604578dbd2a65076bd23 (MD5)
  Previous issue date: 2013-06","Lui, M. & Slotta, J. D. (2013). Exploring Evolutionary Concepts with Immersive Simulations. In Rummel, N., Kapur, M., Nathan, M., & Puntambekar, S. (Eds.), To See the World and a Grain of Sand: Learning across Levels of Space, Time, and Scale: CSCL 2013 Conference Proceedings Volume 1 — Full Papers & Symposia (pp. 304-311). Madison, WI: International Society of the Learning Sciences.","https://repository.isls.org//handle/1/1875","https://doi.dx.org/10.22318/cscl2013.1.304","en","International Society of the Learning Sciences","Exploring Evolutionary Concepts with Immersive Simulations","Full Papers"
"2202acbe-1a39-4d6e-9e24-a0176dd73fb7","1/1765","Marbouti, Farshid||Wise, Alyssa Friend","2020-01-08T18:52:17Z","2019-07-20T19:49:49Z","2020-01-08T18:52:17Z","2019-07-20T19:49:49Z","2013-06","This study investigated whether students exhibited different new-post reading behaviors when using a graphical discussion forum rather than a traditional text-based linear forum. Detailed examination of clickstream patterns in seven case studies showed several differences in reading strategies between the two forums. Most notably, in the graphical forum students read new posts in connection with other related (new or existing) posts, while in the text-based forum new-post reading was disconnected and scattered.","Made available in DSpace on 2020-01-08T18:52:17Z (GMT). No. of bitstreams: 1
305-306.pdf: 161156 bytes, checksum: eeb81e4e9820c5536461ed55706f95bb (MD5)
  Previous issue date: 2013-06","Marbouti, F. & Wise, A. F. (2013). Using a Graphical Interface to Address New Post Bias in Online Discussion Forums. In Rummel, N., Kapur, M., Nathan, M., & Puntambekar, S. (Eds.), To See the World and a Grain of Sand: Learning across Levels of Space, Time, and Scale: CSCL 2013 Conference Proceedings Volume 2 — Short Papers, Panels, Posters, Demos & Community Events (pp. 305-306). Madison, WI: International Society of the Learning Sciences.","https://repository.isls.org//handle/1/1876","https://doi.dx.org/10.22318/cscl2013.2.305","en","International Society of the Learning Sciences","Using a Graphical Interface to Address New Post Bias in Online Discussion Forums","Poster Papers"
"4706a231-760d-4b7f-935f-89876b50b222","1/1765","Martin, Caitlin K.||Barron, Brigid","2020-01-08T18:52:18Z","2019-07-20T19:49:49Z","2020-01-08T18:52:18Z","2019-07-20T19:49:49Z","2013-06","Possibilities and challenges inherent in networked learning environments call for ways of looking at teacher use of online spaces. We share mixed method research of two teachers and their students in a citizen science program. Although the teachers had similar levels of success with the program, they interpreted the purpose of the online environment differently. One used it as a space for students to publish perfected work while the other used it alongside students to build knowledge and foster community.","Made available in DSpace on 2020-01-08T18:52:18Z (GMT). No. of bitstreams: 1
307-308.pdf: 132271 bytes, checksum: 9c52dbc53d509beb073fa7b64ef34c0b (MD5)
  Previous issue date: 2013-06","Martin, C. K. & Barron, B. (2013). Navigating Online Learning Environments in the Classroom. In Rummel, N., Kapur, M., Nathan, M., & Puntambekar, S. (Eds.), To See the World and a Grain of Sand: Learning across Levels of Space, Time, and Scale: CSCL 2013 Conference Proceedings Volume 2 — Short Papers, Panels, Posters, Demos & Community Events (pp. 307-308). Madison, WI: International Society of the Learning Sciences.","https://repository.isls.org//handle/1/1877","https://doi.dx.org/10.22318/cscl2013.2.307","en","International Society of the Learning Sciences","Navigating Online Learning Environments in the Classroom","Poster Papers"
"74e40b82-1979-4bdb-9872-565af79fe0c4","1/1765","Martin, Caitlin K.||Barron, Brigid||Mertl, Véronique","2020-01-08T18:52:18Z","2019-07-20T19:49:50Z","2020-01-08T18:52:18Z","2019-07-20T19:49:50Z","2013-06","The 2013 CSCL conference theme--investigating learning across levels of space, time, and scale--has becoming an increasingly important issue with the proliferation of new types of networked learning environments. In this paper we share our approach to studying and designing for learning across settings and time, grounded in an investigation of a citizen science program that takes place in the classroom, outdoors, and online.","Made available in DSpace on 2020-01-08T18:52:18Z (GMT). No. of bitstreams: 1
309-310.pdf: 174630 bytes, checksum: 3fa8a880892b64e8b766aafb3f4972f9 (MD5)
  Previous issue date: 2013-06","Martin, C. K., Barron, B., & Mertl, V. (2013). Design Methods to Study Learning Across Networked Systems, Co-Located Spaces, and Time. In Rummel, N., Kapur, M., Nathan, M., & Puntambekar, S. (Eds.), To See the World and a Grain of Sand: Learning across Levels of Space, Time, and Scale: CSCL 2013 Conference Proceedings Volume 2 — Short Papers, Panels, Posters, Demos & Community Events (pp. 309-310). Madison, WI: International Society of the Learning Sciences.","https://repository.isls.org//handle/1/1878","https://doi.dx.org/10.22318/cscl2013.2.309","en","International Society of the Learning Sciences","Design Methods to Study Learning Across Networked Systems, Co-Located Spaces, and Time","Poster Papers"
"09553ad6-faaa-46a3-8b17-46f718ea118c","1/1765","Martínez-Monés, Alejandra||Reffay, Christophe||Teplovs, Christopher","2020-01-08T18:52:19Z","2019-07-20T19:49:50Z","2020-01-08T18:52:19Z","2019-07-20T19:49:50Z","2013-06","Social network analysis (SNA) has emerged as a widely used approach to study structural aspects of collaboration. However, its techniques have not been fully exploited yet in CSCL. This paper presents the main results of a survey that focused on identifying the existing approaches for the study of cohesion in CSCL using SNA techniques. It also points out some challenges and future research lines in this area.","Made available in DSpace on 2020-01-08T18:52:19Z (GMT). No. of bitstreams: 1
311-312.pdf: 157295 bytes, checksum: f4b6c6e905dca7e8d54de1e556f7d03b (MD5)
  Previous issue date: 2013-06","Martínez-Monés, A., Reffay, C., & Teplovs, C. (2013). Beyond Sociograms Inspection: What Social Network Analysis Has To Offer to Measure Cohesion in CSCL. In Rummel, N., Kapur, M., Nathan, M., & Puntambekar, S. (Eds.), To See the World and a Grain of Sand: Learning across Levels of Space, Time, and Scale: CSCL 2013 Conference Proceedings Volume 2 — Short Papers, Panels, Posters, Demos & Community Events (pp. 311-312). Madison, WI: International Society of the Learning Sciences.","https://repository.isls.org//handle/1/1879","https://doi.dx.org/10.22318/cscl2013.2.311","en","International Society of the Learning Sciences","Beyond Sociograms Inspection: What Social Network Analysis Has To Offer to Measure Cohesion in CSCL","Poster Papers"
"0438319d-fbc9-4b1e-9cc4-a88853a6ea16","1/1765","Magee, Rachel M.||Mascaro, Christopher M.||Stahl, Gerry","2020-01-08T18:52:19Z","2019-05-22T09:50:59Z","2020-01-08T18:52:19Z","2019-05-22T09:50:59Z","2013-06","We are developing a socio-technical system to support group cognition among math students in the form of significant mathematical discourse about dependencies in dynamic-geometry constructions. Analysis of a pilot trial in a typical early cycle of our design-based-research approach revealed barriers to group success from both software and mathematics issues, and demonstrated that participants ""cycled"" between these types of issues. We are responding by developing a curriculum to address the uncovered technical and cognitive issues. We present the findings of our pilot study and the curriculum design criteria that are emerging from continuing cycles of re-design, prototyping, testing and analysis.","Made available in DSpace on 2020-01-08T18:52:19Z (GMT). No. of bitstreams: 1
312-319.pdf: 262465 bytes, checksum: b9bba05fb1b3395e8d9359ac466f224b (MD5)
  Previous issue date: 2013-06","Magee, R. M., Mascaro, C. M., & Stahl, G. (2013). Designing for Group Math Discourse. In Rummel, N., Kapur, M., Nathan, M., & Puntambekar, S. (Eds.), To See the World and a Grain of Sand: Learning across Levels of Space, Time, and Scale: CSCL 2013 Conference Proceedings Volume 1 — Full Papers & Symposia (pp. 312-319). Madison, WI: International Society of the Learning Sciences.","https://repository.isls.org//handle/1/1880","https://doi.dx.org/10.22318/cscl2013.1.312","en","International Society of the Learning Sciences","Designing for Group Math Discourse","Full Papers"
"7727fbfe-3637-4ecf-8596-e85b4c3086f5","1/1765","Mercier, Emma||Vourloumi, Georgia||Higgins, Steven","2020-01-08T18:52:19Z","2019-07-20T19:49:51Z","2020-01-08T18:52:19Z","2019-07-20T19:49:51Z","2013-06","Multi-touch technology has the potential to support collaboration, although there is little evidence about how collaborating using this technology differs from collaboration with traditional materials. In this paper, we examine the interaction behaviors of four groups working with a multi-touch table, and four groups working on a paper-based version of the same task. Results indicate that more ideas are introduced and developed by students in the multi-touch condition.","Made available in DSpace on 2020-01-08T18:52:19Z (GMT). No. of bitstreams: 1
313-314.pdf: 534104 bytes, checksum: 731b0157ff79148ca84fe25fda191a17 (MD5)
  Previous issue date: 2013-06","Mercier, E., Vourloumi, G., & Higgins, S. (2013). Idea Development in Multi-Touch and Paper-Based Collaborative Problem Solving. In Rummel, N., Kapur, M., Nathan, M., & Puntambekar, S. (Eds.), To See the World and a Grain of Sand: Learning across Levels of Space, Time, and Scale: CSCL 2013 Conference Proceedings Volume 2 — Short Papers, Panels, Posters, Demos & Community Events (pp. 313-314). Madison, WI: International Society of the Learning Sciences.","https://repository.isls.org//handle/1/1881","https://doi.dx.org/10.22318/cscl2013.2.313","en","International Society of the Learning Sciences","Idea Development in Multi-Touch and Paper-Based Collaborative Problem Solving","Poster Papers"
"7255d0ae-5e54-4770-801b-2c8b925d3962","1/1765","Metcalf, Shari||Kamarainen, Amy M.||Grotzer, Tina||Dede, Chris","2020-01-08T18:52:20Z","2019-07-20T19:49:52Z","2020-01-08T18:52:20Z","2019-07-20T19:49:52Z","2013-06","EcoMUVE is a middle school science curriculum that provides an immersive virtual eccosystem in which students learn about complex causality through collaborative inquiry activities. We describe case study research focused on EcoMUVE's supports for collaborative learning, including a jigsaw pedagogy and in-world supports such as chat and data sharing.","Made available in DSpace on 2020-01-08T18:52:20Z (GMT). No. of bitstreams: 1
315-316.pdf: 292637 bytes, checksum: 424a67e27b0d941ea24b005545f12880 (MD5)
  Previous issue date: 2013-06","Metcalf, S., Kamarainen, A. M., Grotzer, T., & Dede, C. (2013). Collaborative Learning in Virtual Environments: Role-Based Exploration of Causality in Ecosystems Over Time and Scale. In Rummel, N., Kapur, M., Nathan, M., & Puntambekar, S. (Eds.), To See the World and a Grain of Sand: Learning across Levels of Space, Time, and Scale: CSCL 2013 Conference Proceedings Volume 2 — Short Papers, Panels, Posters, Demos & Community Events (pp. 315-316). Madison, WI: International Society of the Learning Sciences.","https://repository.isls.org//handle/1/1882","https://doi.dx.org/10.22318/cscl2013.2.315","en","International Society of the Learning Sciences","Collaborative Learning in Virtual Environments: Role-Based Exploration of Causality in Ecosystems Over Time and Scale","Poster Papers"
