id,collection,dc.contributor.author[],dc.date.accessioned,dc.date.accessioned[],dc.date.available,dc.date.available[],dc.date.issued[],dc.description.abstract[en_US],dc.description.provenance[en],dc.identifier.citation[en_US],dc.identifier.uri,dc.identifier.uri[],dc.language.iso[en_US],dc.publisher[en_US],dc.title[en_US],dc.type[en_US]
"540f5c13-b822-46db-a229-ea41c14737fc","1/2635","Emig, Brandon||McDonald, Scott","2020-01-09T14:13:31Z","2020-01-08T21:54:16Z","2020-01-09T14:13:31Z","2020-01-08T21:54:16Z","2010-06","Analogical mapping is evaluated as a scaffold for smal-lgroup argumentation and learning. In this study, groups of four students are invited ot analogically map simple machines while creating an argument about which two are most analogically similar. Qualitative and quantitative analysis of video and transcripts show dense argumentation with mutual understanding among students numerous claims. Fifteen out of egihteen claims were normative, suggesting student learning was directed toward functional fetaures of simple machines.","Made available in DSpace on 2020-01-09T14:13:31Z (GMT). No. of bitstreams: 1
324-325.pdf: 178231 bytes, checksum: f350debf6f8a806a16b04bfd9bac160e (MD5)
  Previous issue date: 2010-06","Emig, B. & McDonald, S. (2010). How does the use of analogical mapping as a scaffold for science learners' argumentation support their learning and talking about science?. In Gomez, K., Lyons, L., & Radinsky, J. (Eds.), Learning in the Disciplines: Proceedings of the 9th International Conference of the Learning Sciences (ICLS 2010) - Volume 2, Short Papers, Symposia, and Selected Abstracts (pp. 324-325). Chicago IL: International Society of the Learning Sciences.","https://repository.isls.org//handle/1/2837","https://doi.dx.org/10.22318/icls2010.2.324","en","International Society of the Learning Sciences (ISLS)","How does the use of analogical mapping as a scaffold for science learners' argumentation support their learning and talking about science?","Posters"
"e5b50fc1-4da5-455b-9ed6-3268f594d4b8","1/2635","Law, Nancy||Yuen, Johnny||Leng, Jing||Wong, O W","2020-01-09T14:13:31Z","2020-01-08T21:54:16Z","2020-01-09T14:13:31Z","2020-01-08T21:54:16Z","2010-06","This paper reports on a preliminary attempt to examine the relationship between community knowledge advancement and advances in understanding made by individual learners based on Popper's (1971) Darwinian theory of knowledge and the view that theoretical, more abstract knowledge is at a higher level than specialized instances of that knowledge. The study is carried out using online discourse data collected over a period of about two weeks in the context of an international knowledge-building program.","Made available in DSpace on 2020-01-09T14:13:31Z (GMT). No. of bitstreams: 1
326-327.pdf: 140239 bytes, checksum: 2c1df4566cd838b3b2a82ca6b13c96ef (MD5)
  Previous issue date: 2010-06","Law, N., Yuen, J., Leng, J., & Wong, O. W. (2010). Community knowledge advancement and individual learning. In Gomez, K., Lyons, L., & Radinsky, J. (Eds.), Learning in the Disciplines: Proceedings of the 9th International Conference of the Learning Sciences (ICLS 2010) - Volume 2, Short Papers, Symposia, and Selected Abstracts (pp. 326-327). Chicago IL: International Society of the Learning Sciences.","https://repository.isls.org//handle/1/2838","https://doi.dx.org/10.22318/icls2010.2.326","en","International Society of the Learning Sciences (ISLS)","Community knowledge advancement and individual learning","Posters"
"8763ad6b-09fd-40ba-aa20-488c0c8c2fb8","1/2635","Sipitakiat, Arnan","2020-01-09T14:13:31Z","2020-01-08T21:54:16Z","2020-01-09T14:13:31Z","2020-01-08T21:54:16Z","2010-06","The purpose of this study is to investigate how new learning possibilities could take place in environments where students are saturated with laptops. Specifically, this work draws upon in situ examples collected from three schools in Thailand over a one year period to highlight how the schools are evolving using a theoretical framework that treats change as a developmental process.","Made available in DSpace on 2020-01-09T14:13:31Z (GMT). No. of bitstreams: 1
328-329.pdf: 356031 bytes, checksum: 6c009230550552b17769426ed446995e (MD5)
  Previous issue date: 2010-06","Sipitakiat, A. (2010). Moving Towards Learning with One-to-One Laptop: A Longitudinal Case Study on Tools, People, and Institutions. In Gomez, K., Lyons, L., & Radinsky, J. (Eds.), Learning in the Disciplines: Proceedings of the 9th International Conference of the Learning Sciences (ICLS 2010) - Volume 2, Short Papers, Symposia, and Selected Abstracts (pp. 328-329). Chicago IL: International Society of the Learning Sciences.","https://repository.isls.org//handle/1/2839","https://doi.dx.org/10.22318/icls2010.2.328","en","International Society of the Learning Sciences (ISLS)","Moving Towards Learning with One-to-One Laptop: A Longitudinal Case Study on Tools, People, and Institutions","Posters"
"c7806433-4ff4-46e9-b31f-23d523bb0d6e","1/2635","Steinkuehler, Constance||King, Elizabeth||Alagoz, Esra||Oh, Yoonsin||Chu, Sarah||Zhang, Bei||Bakar, Aysegul||Martin, Crystle","2020-01-09T14:13:32Z","2020-01-08T21:54:17Z","2020-01-09T14:13:32Z","2020-01-08T21:54:17Z","2010-06","This poster outlines an two-year ethnography of an informal after school lab for adolescent boys using the online game World of Warcraft. The purpose of the lab was to promote academic interests and practices to participants who were generally disengaged in traditional school settings. A variety of data was collected including chatlogs, multimedia fieldnotes, etc. The data was coded and analyzed, and general findings show that academic skills were used in a non- academic setting.","Made available in DSpace on 2020-01-09T14:13:32Z (GMT). No. of bitstreams: 1
330-331.pdf: 183634 bytes, checksum: 1fd0ac3f6d257098650e60b1ab5be50f (MD5)
  Previous issue date: 2010-06","Steinkuehler, C., King, E., Alagoz, E., Oh, Y., Chu, S., Zhang, B., Bakar, A., & Martin, C. (2010). Using a designed, online games based affinity space as a quasi-natural ethnographic context and experiment lab. In Gomez, K., Lyons, L., & Radinsky, J. (Eds.), Learning in the Disciplines: Proceedings of the 9th International Conference of the Learning Sciences (ICLS 2010) - Volume 2, Short Papers, Symposia, and Selected Abstracts (pp. 330-331). Chicago IL: International Society of the Learning Sciences.","https://repository.isls.org//handle/1/2840","https://doi.dx.org/10.22318/icls2010.2.330","en","International Society of the Learning Sciences (ISLS)","Using a designed, online games based affinity space as a quasi-natural ethnographic context and experiment lab","Posters"
"dc1333f5-6e19-4b96-9e82-289c24c18261","1/2635","Occhino, Michael||Luehmann, April Lynn","2020-01-09T14:13:32Z","2020-01-08T21:54:17Z","2020-01-09T14:13:32Z","2020-01-08T21:54:17Z","2010-06","An exploratory case study approach was used to study twenty pre-service secondary science teachers to learn: What impact does post-activity reflection debriefs have on teacher identity development as a reform-minded science teacher? Analysis of debrief video and audio recordings revealed that debriefs provide opportunities for pre-service teachers to wrestle with issues related to practice and the struggle to enact the reform-based practices that they are learning about and believe they should implement.","Made available in DSpace on 2020-01-09T14:13:32Z (GMT). No. of bitstreams: 1
332-333.pdf: 148724 bytes, checksum: c584c8fad097aab5183ebcdf94847e4e (MD5)
  Previous issue date: 2010-06","Occhino, M. & Luehmann, A. L. (2010). Facilitation of reform based teacher identity development in pre-service teachers using post-activity reflection debriefs. In Gomez, K., Lyons, L., & Radinsky, J. (Eds.), Learning in the Disciplines: Proceedings of the 9th International Conference of the Learning Sciences (ICLS 2010) - Volume 2, Short Papers, Symposia, and Selected Abstracts (pp. 332-333). Chicago IL: International Society of the Learning Sciences.","https://repository.isls.org//handle/1/2841","https://doi.dx.org/10.22318/icls2010.2.332","en","International Society of the Learning Sciences (ISLS)","Facilitation of reform based teacher identity development in pre-service teachers using post-activity reflection debriefs","Posters"
"11e1764a-475b-4afb-8ad4-b27400840e81","1/2635","Strijbos, Jan-Willem||Pat-El, Ron J.||Narciss, Susanne","2020-01-09T14:13:32Z","2020-01-08T21:54:18Z","2020-01-09T14:13:32Z","2020-01-08T21:54:18Z","2010-06","The efficiency of feedback content has received much attention in prior feedback research, but students' feedback perceptions have hardly been studied. A structural validation was conducted of a feedback perceptions questionnaire amongst 1535 secondary education students. The structural validity of the scales was confirmed: fairness (FA), usefulness (US) and acceptance (AC) constitute the joined component `Perceived Adequacy of Feedback' (PAF), which in turn positively predicts willingness to improve (WI) and affect (AF).","Made available in DSpace on 2020-01-09T14:13:32Z (GMT). No. of bitstreams: 1
334-335.pdf: 1161530 bytes, checksum: 0dd0c66e597a1aa5b4b6ce6f201441f8 (MD5)
  Previous issue date: 2010-06","Strijbos, J., Pat-El, R. J., & Narciss, S. (2010). Structural validation of a feedback perceptions questionnaire. In Gomez, K., Lyons, L., & Radinsky, J. (Eds.), Learning in the Disciplines: Proceedings of the 9th International Conference of the Learning Sciences (ICLS 2010) - Volume 2, Short Papers, Symposia, and Selected Abstracts (pp. 334-335). Chicago IL: International Society of the Learning Sciences.","https://repository.isls.org//handle/1/2842","https://doi.dx.org/10.22318/icls2010.2.334","en","International Society of the Learning Sciences (ISLS)","Structural validation of a feedback perceptions questionnaire","Posters"
"4edfbdc6-f774-4f27-9ae2-5eea8618a28c","1/2635","West, Richard||Wright, Geoff||Tateishi, Isaku||Randall, Dan","2020-01-09T14:13:32Z","2020-01-08T21:54:18Z","2020-01-09T14:13:32Z","2020-01-08T21:54:18Z","2010-06","Collaborative creativity often is lacking in university learning, despite its relevance to the 21st Century workplace. We describe two case studies of designed environments to teach collaborative creativity, along with the successes and challenges that we found in each approach. Overall, we found both environments, though different, to foster collaborative creativity, while there are still areas for improved instruction.","Made available in DSpace on 2020-01-09T14:13:32Z (GMT). No. of bitstreams: 1
336-337.pdf: 147895 bytes, checksum: f31e904307612c93c3bf53f6d4b945a4 (MD5)
  Previous issue date: 2010-06","West, R., Wright, G., Tateishi, I., & Randall, D. (2010). Designing Environments to Encourage Collaborative Creativity: Two Case Studies in Higher Education. In Gomez, K., Lyons, L., & Radinsky, J. (Eds.), Learning in the Disciplines: Proceedings of the 9th International Conference of the Learning Sciences (ICLS 2010) - Volume 2, Short Papers, Symposia, and Selected Abstracts (pp. 336-337). Chicago IL: International Society of the Learning Sciences.","https://repository.isls.org//handle/1/2843","https://doi.dx.org/10.22318/icls2010.2.336","en","International Society of the Learning Sciences (ISLS)","Designing Environments to Encourage Collaborative Creativity: Two Case Studies in Higher Education","Posters"
"ca3b9a41-60e6-4afc-88dc-3185cf08cc30","1/2635","Orrill, Chandra||Izsak, Andrew||Jacobson, Erik||de Araujo, Zandra","2020-01-09T14:13:33Z","2020-01-08T21:54:18Z","2020-01-09T14:13:33Z","2020-01-08T21:54:18Z","2010-06","We analyze how middle grades teachers in a professional development program reasoned about fraction arithmetic using length and area models. We discovered that teachers' abilities to partition length and area quantities were critical. In particular, we focus on ways that teachers' used multiplication factor/product relationships, distributive reasoning, and levels of units. Our findings contribute to the learning sciences' growing understanding of what teachers must know in order to use drawn representations effectively in instruction.","Made available in DSpace on 2020-01-09T14:13:33Z (GMT). No. of bitstreams: 1
338-339.pdf: 145064 bytes, checksum: e3261f96d95fd2014432e4df2f8857e0 (MD5)
  Previous issue date: 2010-06","Orrill, C., Izsak, A., Jacobson, E., & de Araujo, Z. (2010). Teachers' Understanding of Partitioning When Modeling Fraction Arithmetic. In Gomez, K., Lyons, L., & Radinsky, J. (Eds.), Learning in the Disciplines: Proceedings of the 9th International Conference of the Learning Sciences (ICLS 2010) - Volume 2, Short Papers, Symposia, and Selected Abstracts (pp. 338-339). Chicago IL: International Society of the Learning Sciences.","https://repository.isls.org//handle/1/2844","https://doi.dx.org/10.22318/icls2010.2.338","en","International Society of the Learning Sciences (ISLS)","Teachers' Understanding of Partitioning When Modeling Fraction Arithmetic","Posters"
"5dd978e7-8a7b-4a5a-bc0e-ec61e9da2791","1/2635","Asher, Itay||Nasser, Samira||Ganaim, Lina||Tabak, Iris","2020-01-09T14:13:33Z","2020-01-08T21:54:19Z","2020-01-09T14:13:33Z","2020-01-08T21:54:19Z","2010-06","A comparative synthesis of multiple graphs is a common practice in scientists' work as well as in everyday contexts. We refer to this process as graph meta-analysis. We present findings from a classroom enactment in which cultivating students' graph meta- analysis skills was one aspect of fostering scientific literacy through an inquiry-based unit on socio-scientific dilemmas. We highlight the challenges that learners and teachers encountered, and their implications for future instruction and design.","Made available in DSpace on 2020-01-09T14:13:33Z (GMT). No. of bitstreams: 1
340-341.pdf: 79475 bytes, checksum: e814920d5ea7eb834688b9d5b181e5f6 (MD5)
  Previous issue date: 2010-06","Asher, I., Nasser, S., Ganaim, L., & Tabak, I. (2010). Putting the pieces together: The challenge and value of synthesizing disparate graphs in inquiry-based science learning. In Gomez, K., Lyons, L., & Radinsky, J. (Eds.), Learning in the Disciplines: Proceedings of the 9th International Conference of the Learning Sciences (ICLS 2010) - Volume 2, Short Papers, Symposia, and Selected Abstracts (pp. 340-341). Chicago IL: International Society of the Learning Sciences.","https://repository.isls.org//handle/1/2845","https://doi.dx.org/10.22318/icls2010.2.340","en","International Society of the Learning Sciences (ISLS)","Putting the pieces together: The challenge and value of synthesizing disparate graphs in inquiry-based science learning","Posters"
"c35abe4d-16cc-4f65-85c4-b8b540ca905d","1/2635","El-Moslimany, Hebbah||Duncan, Ravit Golan||McDonnell, Janice||Lichtenwalner, Sage","2020-01-09T14:13:33Z","2020-01-08T21:54:19Z","2020-01-09T14:13:33Z","2020-01-08T21:54:19Z","2010-06","Researchers have advocated for the development of educative curriculum materials to support teachers as they engage in reform-oriented teaching. In this poster we report on the design and evaluation of a set of just-in-time, educative, teacher supports for an online project-based unit. Our design of the supports was informed by frameworks for educative materials (e.g. Davis &amp; Krajcik, 2005), and we analyzed their use with 17 middle and high school teachers in a pilot study.","Made available in DSpace on 2020-01-09T14:13:33Z (GMT). No. of bitstreams: 1
342-343.pdf: 136902 bytes, checksum: af51822d2e1ed8a27e45f3fcdc0023f4 (MD5)
  Previous issue date: 2010-06","El-Moslimany, H., Duncan, R. G., McDonnell, J., & Lichtenwalner, S. (2010). The Design and Evaluation of Educative Just-In-Time Teacher Supports in a Web-Based Environment. In Gomez, K., Lyons, L., & Radinsky, J. (Eds.), Learning in the Disciplines: Proceedings of the 9th International Conference of the Learning Sciences (ICLS 2010) - Volume 2, Short Papers, Symposia, and Selected Abstracts (pp. 342-343). Chicago IL: International Society of the Learning Sciences.","https://repository.isls.org//handle/1/2846","https://doi.dx.org/10.22318/icls2010.2.342","en","International Society of the Learning Sciences (ISLS)","The Design and Evaluation of Educative Just-In-Time Teacher Supports in a Web-Based Environment","Posters"
"8a8c0ce6-9473-4f07-8b11-59fcaee6897a","1/2635","Lee, Victor||DuMont, Maneksha","2020-01-09T14:13:33Z","2020-01-08T21:54:19Z","2020-01-09T14:13:33Z","2020-01-08T21:54:19Z","2010-06","Through a design experiment, we explored the potential for a suite of commercial physical activity monitoring devices to be used as data collection tools. Two pairs of high- school students were asked to engage in a week-long set of data investigations of physical activity that culminated in the design and implementation of their own mini-studies. This poster reports on those mini-studies, the challenges associated with the technologies used, and the supports that needed to be introduced.","Made available in DSpace on 2020-01-09T14:13:33Z (GMT). No. of bitstreams: 1
344-345.pdf: 141117 bytes, checksum: 594598032fe3d29af5a0c1f3a97f6a80 (MD5)
  Previous issue date: 2010-06","Lee, V. & DuMont, M. (2010). Students' Investigations with Physical Activity Data Devices. In Gomez, K., Lyons, L., & Radinsky, J. (Eds.), Learning in the Disciplines: Proceedings of the 9th International Conference of the Learning Sciences (ICLS 2010) - Volume 2, Short Papers, Symposia, and Selected Abstracts (pp. 344-345). Chicago IL: International Society of the Learning Sciences.","https://repository.isls.org//handle/1/2847","https://doi.dx.org/10.22318/icls2010.2.344","en","International Society of the Learning Sciences (ISLS)","Students' Investigations with Physical Activity Data Devices","Posters"
"4e8fca63-5877-45a2-9c60-f8e93d42800b","1/2635","Duncan, Sean","2020-01-09T14:13:34Z","2020-01-08T21:54:20Z","2020-01-09T14:13:34Z","2020-01-08T21:54:20Z","2010-06","In order to address ""design talk"" within online gaming fan spaces, content analyses were used first to classify the predominant forms of design talk, then to provide a principled segmentation of forum data to come under further Discourse analysis. Serial implementation of these two approaches affords researchers of informal learning the ability to (1) identify productive exchanges within gaming affinity spaces to come under further d/Discursive analysis and (2) combine analyses of learning using both nomothetic (content analysis) and idiographic (Discourse analysis) approaches.","Made available in DSpace on 2020-01-09T14:13:34Z (GMT). No. of bitstreams: 1
346-347.pdf: 141562 bytes, checksum: 83714c97db2ff558e6b47c9d809fcd23 (MD5)
  Previous issue date: 2010-06","Duncan, S. (2010). A dual-level approach for investigating design in online affinity spaces. In Gomez, K., Lyons, L., & Radinsky, J. (Eds.), Learning in the Disciplines: Proceedings of the 9th International Conference of the Learning Sciences (ICLS 2010) - Volume 2, Short Papers, Symposia, and Selected Abstracts (pp. 346-347). Chicago IL: International Society of the Learning Sciences.","https://repository.isls.org//handle/1/2848","https://doi.dx.org/10.22318/icls2010.2.346","en","International Society of the Learning Sciences (ISLS)","A dual-level approach for investigating design in online affinity spaces","Posters"
"87b233aa-8f99-445f-b4ef-bb81213ec57a","1/2635","Dasgupta, Chandan||Lyons, Leilah||Zellner, Moira||Greenlee, Andrew","2020-01-09T14:13:34Z","2020-01-08T21:54:20Z","2020-01-09T14:13:34Z","2020-01-08T21:54:20Z","2010-06","Modern planning practices recruit stakeholders to add specialized expertise to the planning process, but this expertise often remains inert, leading to superficial and circular discussions. By encouraging stakeholders co-construct an external shared representation, more nuanced debates could emerge. This work reports on formative interviews that will inform the design of software that will allow stakeholders to articulate and share their knowledge, and to inspect the underlying assumptions of others and the outcomes of the system.","Made available in DSpace on 2020-01-09T14:13:34Z (GMT). No. of bitstreams: 1
348-349.pdf: 81849 bytes, checksum: c6955e6ece31c846e817274f6ec47619 (MD5)
  Previous issue date: 2010-06","Dasgupta, C., Lyons, L., Zellner, M., & Greenlee, A. (2010). Designing for an Informal Learning Environment: Towards a Participatory Simulation Design Process for Public Policy Planning. In Gomez, K., Lyons, L., & Radinsky, J. (Eds.), Learning in the Disciplines: Proceedings of the 9th International Conference of the Learning Sciences (ICLS 2010) - Volume 2, Short Papers, Symposia, and Selected Abstracts (pp. 348-349). Chicago IL: International Society of the Learning Sciences.","https://repository.isls.org//handle/1/2849","https://doi.dx.org/10.22318/icls2010.2.348","en","International Society of the Learning Sciences (ISLS)","Designing for an Informal Learning Environment: Towards a Participatory Simulation Design Process for Public Policy Planning","Posters"
"30e55091-a506-4596-a8da-ce9f10fb7f42","1/2635","Kerlin, Steven||Goehring, Elizabeth||Carlsen, William","2020-01-09T14:13:35Z","2020-01-08T21:54:20Z","2020-01-09T14:13:35Z","2020-01-08T21:54:20Z","2010-06","Students' views of their online collaboration and samples of scientific writing were studied within a principal contrast of U.S. students in domestic or international class partnerships. Results show that U.S. students in international partnerships maintained a higher level of excitement about their partnership and wrote a larger number of accurate scientific claims using more evidence and certain discourse components. Findings from this study have implications for further research and classroom practice.","Made available in DSpace on 2020-01-09T14:13:35Z (GMT). No. of bitstreams: 1
350-351.pdf: 145820 bytes, checksum: f2441c16a3abfc5d98a3eda6548d1954 (MD5)
  Previous issue date: 2010-06","Kerlin, S., Goehring, E., & Carlsen, W. (2010). Online Science Classroom Collaborations: A Comparison of Domestic and International Learning Communities. In Gomez, K., Lyons, L., & Radinsky, J. (Eds.), Learning in the Disciplines: Proceedings of the 9th International Conference of the Learning Sciences (ICLS 2010) - Volume 2, Short Papers, Symposia, and Selected Abstracts (pp. 350-351). Chicago IL: International Society of the Learning Sciences.","https://repository.isls.org//handle/1/2850","https://doi.dx.org/10.22318/icls2010.2.350","en","International Society of the Learning Sciences (ISLS)","Online Science Classroom Collaborations: A Comparison of Domestic and International Learning Communities","Posters"
"52e01342-f4dd-4735-a6f7-d6cd2f12af8c","1/2635","Jimenez, Osvaldo||Blair, Kristen Pilner||Esmonde, Indigo||Goldman, Shelley||Martin, Lee||Pea, Roy","2020-01-09T14:13:35Z","2020-01-08T21:54:21Z","2020-01-09T14:13:35Z","2020-01-08T21:54:21Z","2010-06","Based on interviews with 21 families, we found that school-aged children and their families engage in rich forms of mathematical reasoning as they engage in play and leisure activities at home. We present examples of the wide variety of activities and kinds of math reported, as well as an in-depth look at a few cases. From our results, we draw design implications for linking formal and informal mathematics learning.","Made available in DSpace on 2020-01-09T14:13:35Z (GMT). No. of bitstreams: 1
352-353.pdf: 118175 bytes, checksum: e7c88fc2113024990ca326c06bb499d5 (MD5)
  Previous issue date: 2010-06","Jimenez, O., Blair, K. P., Esmonde, I., Goldman, S., Martin, L., & Pea, R. (2010). Mathematics at Play. In Gomez, K., Lyons, L., & Radinsky, J. (Eds.), Learning in the Disciplines: Proceedings of the 9th International Conference of the Learning Sciences (ICLS 2010) - Volume 2, Short Papers, Symposia, and Selected Abstracts (pp. 352-353). Chicago IL: International Society of the Learning Sciences.","https://repository.isls.org//handle/1/2851","https://doi.dx.org/10.22318/icls2010.2.352","en","International Society of the Learning Sciences (ISLS)","Mathematics at Play","Posters"
