id,collection,dc.contributor.author,dc.contributor.author[],dc.date.accessioned,dc.date.accessioned[],dc.date.available,dc.date.available[],dc.date.issued,dc.date.issued[],dc.description.abstract[en_US],dc.description.provenance[en],dc.identifier.citation[en_US],dc.identifier.uri,dc.identifier.uri[],dc.language.iso[en_US],dc.publisher[en_US],dc.title[en_US],dc.type[en_US]
"9cf9f02a-d038-4114-9255-cef20166cdd2","1/98",,"Siebert-Evenstone, Amanda L.||Arastoopour, Golnaz||Collier, Wesley||Swiecki, Zachari||Ruis, Andrew R.||Shaffer, David Williamson","2017-05-27T14:30:31Z","2017-03-21T12:05:42Z","2017-05-27T14:30:31Z","2017-03-21T12:05:42Z",,"2016-07","Analyses of learning based on student discourse need to account not only for the content of the utterances but also for the ways in which students make connections across turns of talk. This requires segmentation of the discourse data to define when connections are likely to be meaningful. In this paper, we present a novel approach to segmenting data for the purposes of modeling connections in discourse. Specifically, we use epistemic network analysis to model connections in student discourse using a temporal segmentation method adapted from recent work in the learning sciences. We compare the results to a purely topic-based segmentation method to examine the affordances of temporal segmentation for modeling connections in discourse.","Made available in DSpace on 2017-05-27T14:30:31Z (GMT). No. of bitstreams: 1
82.pdf: 353619 bytes, checksum: 15b247de1fd8425681dd172670e1e968 (MD5)
  Previous issue date: 2016-07","Siebert-Evenstone, A. L., Arastoopour, G., Collier, W., Swiecki, Z., Ruis, A. R., & Shaffer, D. W. (2016). In Search of Conversational Grain Size:  Modeling Semantic Structure Using Moving Stanza Windows In Looi, C. K., Polman, J. L., Cress, U., and Reimann, P. (Eds.). Transforming Learning, Empowering Learners: The International Conference of the Learning Sciences (ICLS) 2016, Volume 1. Singapore: International Society of the Learning Sciences.","https://repository.isls.org/handle/1/173","https://dx.doi.org/10.22318/icls2016.82","en","Singapore: International Society of the Learning Sciences","In Search of Conversational Grain Size:  Modeling Semantic Structure Using Moving Stanza Windows","Book chapter"
"151010b8-5662-442b-9ee0-1b2327226320","1/98",,"McKenney, Susan||van Aalst, Jan||Forbes, Cory","2017-05-27T14:30:32Z","2017-03-21T12:05:42Z","2017-05-27T14:30:32Z","2017-03-21T12:05:42Z",,"2016-07","Empirical insights from the learning sciences must be translatable to contexts of application to maximize impact. Despite the importance of dissemination, however, little guidance is available to help researchers proactively bridge the research-practice divide. To address this need, we draw from theoretical perspectives on the utility of empirical research to characterize, illustrate, and discuss three cases involving the communication and translation of research. By offering framework for analysis and initial findings based on three projects in the learning sciences, this paper helps learning scientists conceptualize a range of research-practice connection types and envision how they can take shape in learning sciences projects.","Made available in DSpace on 2017-05-27T14:30:32Z (GMT). No. of bitstreams: 1
83.pdf: 273389 bytes, checksum: 16803475fcfdec9714d39c85ba5b156b (MD5)
  Previous issue date: 2016-07","McKenney, S., van Aalst, J., & Forbes, C. (2016). Realizing Research-Practice Connections: Three Cases From the Learning Sciences In Looi, C. K., Polman, J. L., Cress, U., and Reimann, P. (Eds.). Transforming Learning, Empowering Learners: The International Conference of the Learning Sciences (ICLS) 2016, Volume 1. Singapore: International Society of the Learning Sciences.","https://repository.isls.org/handle/1/174","https://dx.doi.org/10.22318/icls2016.83","en","Singapore: International Society of the Learning Sciences","Realizing Research-Practice Connections: Three Cases From the Learning Sciences","Book chapter"
"42ba811d-277b-40cd-a914-a0131a6e0b07","1/98",,"Chen, Jingping||Zhang, Jianwei","2017-05-27T14:30:33Z","2017-03-21T12:05:42Z","2017-05-27T14:30:33Z","2017-03-21T12:05:42Z",,"2016-07","This design-based study investigated collaborative formative assessment for knowledge building in two comparable Grade 6 science classrooms. Students assessed their collective knowledge progress using the Idea Thread Mapper (ITM)—a timeline-based collective discourse mapping tool—and planned for further efforts to address deeper issues. Analysis of students’ online discourse and individual portfolio notes suggests the positive impact of the assessment on the community’s knowledge building discourse as reflected in students’ idea-deepening and idea-elaborating questions, refined explanations, and build-on connections; and on student scientific understandings as documented in their individual portfolio notes.","Made available in DSpace on 2017-05-27T14:30:33Z (GMT). No. of bitstreams: 1
84.pdf: 355067 bytes, checksum: 0a655e96038fc62b9b9ff6065605da08 (MD5)
  Previous issue date: 2016-07","Chen, J. & Zhang, J. (2016). Design Collaborative Formative Assessment for Sustained Knowledge Building Using Idea Thread Mapper In Looi, C. K., Polman, J. L., Cress, U., and Reimann, P. (Eds.). Transforming Learning, Empowering Learners: The International Conference of the Learning Sciences (ICLS) 2016, Volume 1. Singapore: International Society of the Learning Sciences.","https://repository.isls.org/handle/1/175","https://dx.doi.org/10.22318/icls2016.84","en","Singapore: International Society of the Learning Sciences","Design Collaborative Formative Assessment for Sustained Knowledge Building Using Idea Thread Mapper","Book chapter"
"c7aa412d-37a4-4d09-b630-28e5b089172e","1/98",,"Visintainer, Tammie","2017-05-27T14:30:34Z","2017-03-21T12:05:42Z","2017-05-27T14:30:34Z","2017-03-21T12:05:42Z",,"2016-07","This research explores processes of learning and identity construction for high school students of color as they engage in a community-based scientific research project as part of a summer science program. This research utilizes qualitative (e.g. interviews) and quantitative (e.g. surveys) data sources. Findings illustrate the emergence of an identity generative process: that engaging in science practices (e.g. presenting research) and the accompanying program resources (e.g. placing students in a position of power) generated new possibilities for students as capable science learners, scientists, and change agents. Furthermore, findings show that the instructor’s perspective of science and vision for his students guided the design of program resources (e.g. pedagogy, instruction) made available that helped create these shifts. Findings show that youth of color can imagine new possibilities for who they can be in science if their science and racial identities are supported in science programs.","Made available in DSpace on 2017-05-27T14:30:34Z (GMT). No. of bitstreams: 1
85.pdf: 248426 bytes, checksum: 5fc436ecb6d1323eb154fd011c08d56a (MD5)
  Previous issue date: 2016-07","Visintainer, T. (2016). “I Think We Were Pretty Powerful This Summer as Scientists”: Generating New Possibilities for Youth of Color in Science In Looi, C. K., Polman, J. L., Cress, U., and Reimann, P. (Eds.). Transforming Learning, Empowering Learners: The International Conference of the Learning Sciences (ICLS) 2016, Volume 1. Singapore: International Society of the Learning Sciences.","https://repository.isls.org/handle/1/176","https://dx.doi.org/10.22318/icls2016.85","en","Singapore: International Society of the Learning Sciences","“I Think We Were Pretty Powerful This Summer as Scientists”: Generating New Possibilities for Youth of Color in Science","Book chapter"
"0c454779-5449-408a-b987-625eb28fa5a5","1/98",,"Roque, Ricarose||Lin, Karina||Liuzzi, Richard","2017-05-27T14:30:35Z","2017-03-21T12:05:42Z","2017-05-27T14:30:35Z","2017-03-21T12:05:42Z",,"2016-07","Creating, designing, and building with computing have gained recognition as important activities for children, but few actually engage in these creative opportunities. Social support from parents can be essential to engaging children, but for parents with limited backgrounds in computing, they are often unsure what roles they can play. For parents to develop supportive roles, they must gain first-hand experience in creative computing for themselves and with their children. In this paper, we examine the experiences of parents participating in a community-based program called Family Creative Learning, where families design and invent together using creative technologies like Scratch. We describe three case studies of how parents developed multiple roles such as collaborator, teacher, and learner as they created and collaborated with their children on technology-based projects. We discuss design opportunities to provide meaningful experiences for parents and children to build projects and build supportive roles around computing.","Made available in DSpace on 2017-05-27T14:30:35Z (GMT). No. of bitstreams: 1
86.pdf: 251684 bytes, checksum: 943977f5c8a04f79f2147e3cde1af86d (MD5)
  Previous issue date: 2016-07","Roque, R., Lin, K., & Liuzzi, R. (2016). “I’m Not Just a Mom”: Parents Developing Multiple Roles in Creative Computing In Looi, C. K., Polman, J. L., Cress, U., and Reimann, P. (Eds.). Transforming Learning, Empowering Learners: The International Conference of the Learning Sciences (ICLS) 2016, Volume 1. Singapore: International Society of the Learning Sciences.","https://repository.isls.org/handle/1/177","https://dx.doi.org/10.22318/icls2016.86","en","Singapore: International Society of the Learning Sciences","“I’m Not Just a Mom”: Parents Developing Multiple Roles in Creative Computing","Book chapter"
"ff20bbbf-0b28-44b6-877a-df78c3e013c8","1/98",,"Brasel, Jason||Garner, Brette||Horn, Ilana Seidel","2017-05-27T14:30:35Z","2017-03-21T12:05:42Z","2017-05-27T14:30:35Z","2017-03-21T12:05:42Z",,"2016-07","Teacher workgroups are increasingly mandated in policy as a strategy for instructional improvement, but without accounting for teacher learning. In this comparative case study, we take a situative view of learning to examine the learning opportunities afforded in workgroup meetings with middle-school math teachers and pedagogically expert facilitators. Using interaction analysis, we analyze the role of representations in affording learning opportunities. The facilitators framed workgroup activity differently than the teachers; learning opportunities were limited when teachers were not able to engage the facilitators’ framings. But by introducing rich representations of practice, the facilitators attuned teachers’ attention to key conceptual resources. This scaffolded the workgroup into new forms of practice, thereby supporting teachers’ opportunities to learn more ambitious forms of professional practice. This work highlights the need for facilitators and instructional leaders to attend to issues of teacher learning in collaborative activity.","Made available in DSpace on 2017-05-27T14:30:35Z (GMT). No. of bitstreams: 1
87.pdf: 297622 bytes, checksum: acb78b96df0db85264daf94cbb8ef188 (MD5)
  Previous issue date: 2016-07","Brasel, J., Garner, B., & Horn, I. S. (2016). Scaffolding Into Ambitious Teaching: Representations of Practice in Teacher Workgroups In Looi, C. K., Polman, J. L., Cress, U., and Reimann, P. (Eds.). Transforming Learning, Empowering Learners: The International Conference of the Learning Sciences (ICLS) 2016, Volume 1. Singapore: International Society of the Learning Sciences.","https://repository.isls.org/handle/1/178","https://dx.doi.org/10.22318/icls2016.87","en","Singapore: International Society of the Learning Sciences","Scaffolding Into Ambitious Teaching: Representations of Practice in Teacher Workgroups","Book chapter"
"94b22f83-eb56-4856-992e-97ae9cf4bb61","1/98",,"Hew, Khe Foon||Law, Nancy||Wan, Jarrad||Lee, Yeung||Kwok, Amy","2017-05-27T14:30:36Z","2017-03-21T12:05:42Z","2017-05-27T14:30:36Z","2017-03-21T12:05:42Z",,"2016-07","The notion of self-directed learning (SDL) has gained prominence in many education institutes around the world. However, few studies detail the specific enabling factors that could foster SDL in primary and secondary school science education. Focusing on this gap, we engaged in a mixed methods study that examined 17 schools in Hong Kong, consisting of 10 primary and 7 secondary schools. Altogether, 1,538 students from 55 classes and involving 53 teachers participated in the study which ran from September 2014 to June 2015. Building upon four key SDL representation models, we first developed our three-dimensional SDL conceptual framework to guide our analysis of the specific leadership-, teacher-, and student-related factors that could foster SDL in science education. Five key enabling factors are described.","Made available in DSpace on 2017-05-27T14:30:36Z (GMT). No. of bitstreams: 1
88.pdf: 302048 bytes, checksum: ad039185d413180d9fb70a0acf4b8295 (MD5)
  Previous issue date: 2016-07","Hew, K. F., Law, N., Wan, J., Lee, Y., & Kwok, A. (2016). Self-Directed Learning in Science Education: Explicating the Enabling Factors In Looi, C. K., Polman, J. L., Cress, U., and Reimann, P. (Eds.). Transforming Learning, Empowering Learners: The International Conference of the Learning Sciences (ICLS) 2016, Volume 1. Singapore: International Society of the Learning Sciences.","https://repository.isls.org/handle/1/179","https://dx.doi.org/10.22318/icls2016.88","en","Singapore: International Society of the Learning Sciences","Self-Directed Learning in Science Education: Explicating the Enabling Factors","Book chapter"
"c2185a72-6782-424a-a41a-35957e4e46b3","1/98",,"Gutiérrez, José Francisco","2017-05-27T14:30:37Z","2017-03-21T12:05:42Z","2017-05-27T14:30:37Z","2017-03-21T12:05:42Z",,"2016-07","This paper presents a theoretical model of mathematics teaching and learning that captures the reflexive relationship between processes of objectification and subjectification inherent in classroom discourse. I call this model the “obj–subj dialectic,” and ultimately I posit that students’ respective semiotic means of objectification also function, simultaneously, as semiotic means of subjectification. I use this model to analyze and describe the individual student learning of three high school students engaged in a generalization task and the emergent social power dynamics. Findings show that whereas students made statements that positioned themselves as having the correct answer (i.e., as mathematical authorities), some students resorted to a broader arsenal of semiotic resources to make their point, which resulted in differentiated status positions. Thus some students gained “mathematical ascendency” over others, which refers to the co-construction of hierarchical positional identities emerging from the obj–subj dialectic during multimodal interactions.","Made available in DSpace on 2017-05-27T14:30:37Z (GMT). No. of bitstreams: 1
89.pdf: 297013 bytes, checksum: 807fa38d53082902fd40039c0da899af (MD5)
  Previous issue date: 2016-07","Gutiérrez, J. F. (2016). The Obj–Subj Dialectic and the Co-Construction of Hierarchical Positional Identities During a Collaborative Generalization Task In Looi, C. K., Polman, J. L., Cress, U., and Reimann, P. (Eds.). Transforming Learning, Empowering Learners: The International Conference of the Learning Sciences (ICLS) 2016, Volume 1. Singapore: International Society of the Learning Sciences.","https://repository.isls.org/handle/1/180","https://dx.doi.org/10.22318/icls2016.89","en","Singapore: International Society of the Learning Sciences","The Obj–Subj Dialectic and the Co-Construction of Hierarchical Positional Identities During a Collaborative Generalization Task","Book chapter"
"52145db5-751a-4f3b-a7ea-5d6b3c4396dd","1/98",,"Csanadi, Andras||Kollar, Ingo||Fischer, Frank","2017-05-27T14:30:38Z","2017-03-21T12:05:42Z","2017-05-27T14:30:38Z","2017-03-21T12:05:42Z",,"2016-07","To meet high-level problem solving standards, practitioners should optimally solve problems in an evidence-based manner: by using scientific knowledge while engaging in scientific reasoning processes. It can be argued that professionals do this better in groups than individually. Also, heterogeneous groups might have more potential to engage in higher levels of scientific reasoning than homogeneous groups or individuals. The present study investigated these questions in the context of teacher education. 76 teacher students solved a problem case from their future practice either individually or in dyads that were homo- or heterogeneous with respect to their members’ problem solving scripts. The results show that although dyads have an advantage on generating hypotheses to explain the problem; individuals engage more in generating solutions. Moreover, especially heterogeneous dyads seem to differ from individuals’ approaches. Future studies could investigate further how to use groups’ potential in generating hypotheses to facilitate them in generating solutions.","Made available in DSpace on 2017-05-27T14:30:38Z (GMT). No. of bitstreams: 1
9.pdf: 267824 bytes, checksum: 382efd214f237c7d1c8091094b5034a8 (MD5)
  Previous issue date: 2016-07","Csanadi, A., Kollar, I., & Fischer, F. (2016). Scientific Reasoning and Problem Solving in a Practical Domain: Are Two Heads Better Than One? In Looi, C. K., Polman, J. L., Cress, U., and Reimann, P. (Eds.). Transforming Learning, Empowering Learners: The International Conference of the Learning Sciences (ICLS) 2016, Volume 1. Singapore: International Society of the Learning Sciences.","https://repository.isls.org/handle/1/181","https://dx.doi.org/10.22318/icls2016.9","en","Singapore: International Society of the Learning Sciences","Scientific Reasoning and Problem Solving in a Practical Domain: Are Two Heads Better Than One?","Book chapter"
"99aa5f70-4a46-4d1b-ac2f-467555c5e29d","1/98",,"Grover, Shuchi||Pea, Roy","2017-05-27T14:30:39Z","2017-03-21T12:05:42Z","2017-05-27T14:30:39Z","2017-03-21T12:05:42Z",,"2016-07","As computer science (CS) thunders its way into K-12 classrooms, lack of teachers to teach CS and pedagogically sound computing curricula remain significant challenges. This paper describes a design-based research (DBR) approach to create and refine a 7-week middle school introductory CS course—Foundations for Advancing Computational Thinking (FACT)—informed by research in the learning sciences and computing education, and designed for blended in-class learning using online materials created on the OpenEdX platform. The paper shares FACT’s success in achieving a balanced pedagogy to meet its goals for deeper learning of algorithmic concepts, and identifies areas for improvements.","Made available in DSpace on 2017-05-27T14:30:39Z (GMT). No. of bitstreams: 1
90.pdf: 292791 bytes, checksum: c7d5f043ab4245f9a5739bffe7cef5e6 (MD5)
  Previous issue date: 2016-07","Grover, S. & Pea, R. (2016). Designing a Blended, Middle School Computer Science Course for Deeper Learning: A Design-Based Research Approach In Looi, C. K., Polman, J. L., Cress, U., and Reimann, P. (Eds.). Transforming Learning, Empowering Learners: The International Conference of the Learning Sciences (ICLS) 2016, Volume 1. Singapore: International Society of the Learning Sciences.","https://repository.isls.org/handle/1/182","https://dx.doi.org/10.22318/icls2016.90","en","Singapore: International Society of the Learning Sciences","Designing a Blended, Middle School Computer Science Course for Deeper Learning: A Design-Based Research Approach","Book chapter"
"233f05de-ed6f-44cd-98ce-7591a6822c7e","1/98",,"Orton, Kai||Weintrop, David||Beheshti, Elham||Horn, Michael||Jona, Kemi||Wilensky, Uri","2017-05-27T14:30:40Z","2017-03-21T12:05:42Z","2017-05-27T14:30:40Z","2017-03-21T12:05:42Z",,"2016-07","Computation is reshaping modern science and mathematics practices, but relatively few students have access to, or take, courses that adequately prepare them for the increasingly technological nature of these fields. Further, students who do study computational topics tend to not reflect the greater student body, with female and minority students being disproportionately underrepresented. To address these issues, we investigate the approach of embedding computational thinking content into required high school mathematics and science coursework. Using data from a 3-year implementation, we present results showing differences in attitudes towards computing by gender, while also finding similar gaps do not correlate with aptitude. Using pre/post measures, we then show female participants expressed improved confidence with computational thinking and interest in STEM careers. Additionally, we report a dosage effect, where participating in more activities resulted in greater learning gains, providing evidence in support of embedding computational thinking enhanced activities across high school curriculum.","Made available in DSpace on 2017-05-27T14:30:40Z (GMT). No. of bitstreams: 1
91.pdf: 131593 bytes, checksum: d53aac0353f40588f85e90753c3d07f1 (MD5)
  Previous issue date: 2016-07","Orton, K., Weintrop, D., Beheshti, E., Horn, M., Jona, K., & Wilensky, U. (2016). Bringing Computational Thinking Into High School Mathematics and Science Classrooms In Looi, C. K., Polman, J. L., Cress, U., and Reimann, P. (Eds.). Transforming Learning, Empowering Learners: The International Conference of the Learning Sciences (ICLS) 2016, Volume 2. Singapore: International Society of the Learning Sciences.","https://repository.isls.org/handle/1/183","https://dx.doi.org/10.22318/icls2016.91","en","Singapore: International Society of the Learning Sciences","Bringing Computational Thinking Into High School Mathematics and Science Classrooms","Book chapter"
"e2746e2d-1e47-4068-a595-d0adc9297b5c","1/98",,"Hardy, Lisa||White, Tobin","2017-05-27T14:30:41Z","2017-03-21T12:05:42Z","2017-05-27T14:30:41Z","2017-03-21T12:05:42Z",,"2016-07","In this paper we argue that collaborative learning doesn’t necessarily have to culminate in convergent conceptual change in order to be a success—that divergent perspectives can maintain tensions that are productive for learning even if they don’t get reconciled. We analyze the individual perspectival understandings demonstrated by students during and after a collaborative task, and argue that this lens provides mechanisms for showing how collaboration can be productive even in the absence of convergence. We discuss some implications for theories of group understanding, and designing face-to-face CSCL environments and activities.","Made available in DSpace on 2017-05-27T14:30:41Z (GMT). No. of bitstreams: 1
92.pdf: 97952 bytes, checksum: 902c50802c23a445dc683b34a3cbd3eb (MD5)
  Previous issue date: 2016-07","Hardy, L. & White, T. (2016). Making Sense of Making Waves: Co-constructing Knowledge and Group Understanding Without Conceptual Convergence In Looi, C. K., Polman, J. L., Cress, U., and Reimann, P. (Eds.). Transforming Learning, Empowering Learners: The International Conference of the Learning Sciences (ICLS) 2016, Volume 2. Singapore: International Society of the Learning Sciences.","https://repository.isls.org/handle/1/184","https://dx.doi.org/10.22318/icls2016.92","en","Singapore: International Society of the Learning Sciences","Making Sense of Making Waves: Co-constructing Knowledge and Group Understanding Without Conceptual Convergence","Book chapter"
"7ea00e86-2216-440c-a497-d07f8525abae","1/98",,"Uk, Irina||Matuk, Camillia||Linn, Marcia C.","2017-05-27T14:30:42Z","2017-03-21T12:05:42Z","2017-05-27T14:30:42Z","2017-03-21T12:05:42Z",,"2016-07","Scientists rely on graphs to make predictions, interpret data, and articulate arguments about the phenomena they investigate. Yet, students’ initial formal experiences with graphs are limited, and often restricted to their mathematics classes. We describe how we integrated graphs into a middle school science inquiry unit on cell biology. We report on findings from a classroom implementation with 30 middle school students. We describe students’ learning gains and characterize the kinds of graphs they generate in terms of the graphical and scientific understanding demonstrated. This study contributes an example of how curriculum can be designed to simultaneously support students’ science and graph understanding. It also demonstrates how graphs can be used as expressive tools that both limit and enable students’ explanations of complex scientific processes.","Made available in DSpace on 2017-05-27T14:30:42Z (GMT). No. of bitstreams: 1
93.pdf: 66032 bytes, checksum: 9520a0cc0fde567cd2505e4f9113f82a (MD5)
  Previous issue date: 2016-07","Uk, I., Matuk, C., & Linn, M. C. (2016). Students Using Graphs to Understand the Process of Cancer Treatment In Looi, C. K., Polman, J. L., Cress, U., and Reimann, P. (Eds.). Transforming Learning, Empowering Learners: The International Conference of the Learning Sciences (ICLS) 2016, Volume 2. Singapore: International Society of the Learning Sciences.","https://repository.isls.org/handle/1/185","https://dx.doi.org/10.22318/icls2016.93","en","Singapore: International Society of the Learning Sciences","Students Using Graphs to Understand the Process of Cancer Treatment","Book chapter"
