id,collection,dc.contributor.author[],dc.date.accessioned,dc.date.accessioned[],dc.date.available,dc.date.available[],dc.date.issued[],dc.description.abstract[en_US],dc.description.provenance[en],dc.identifier.citation[en_US],dc.identifier.uri,dc.identifier.uri[],dc.language.iso[en_US],dc.publisher[en_US],dc.title[en_US],dc.type[en_US]
"6783ece1-0de1-437b-83da-4c3bb85ad9d6","1/2635","Levin, Daniel||Richards, Jennifer","2020-01-09T14:07:38Z","2020-01-08T21:54:00Z","2020-01-09T14:07:38Z","2020-01-08T21:54:00Z","2010-06","In this paper, we explore how candidates in a science teacher preparation cohort attend to the substance of student thinking while watching classroom videos or reviewing students' written work. Our findings suggest that the teacher candidates are able to attend to specific student ideas and reasoning from the beginning of their pre-service preparation, but their practices of attending become more sophisticated over time. We also consider participation dynamics within the cohort, as participants assume different roles and begin to regulate their discussions.","Made available in DSpace on 2020-01-09T14:07:38Z (GMT). No. of bitstreams: 1
41-48.pdf: 220304 bytes, checksum: 509e124796b13ced6fe9ce0c6ceb0d94 (MD5)
  Previous issue date: 2010-06","Levin, D. & Richards, J. (2010). Exploring how novice teachers learn to attend to students in analyzing case studies of classroom teaching and learning. In Gomez, K., Lyons, L., & Radinsky, J. (Eds.), Learning in the Disciplines: Proceedings of the 9th International Conference of the Learning Sciences (ICLS 2010) - Volume 1, Full Papers (pp. 41-48). Chicago IL: International Society of the Learning Sciences.","https://repository.isls.org//handle/1/2701","https://doi.dx.org/10.22318/icls2010.1.41","en","International Society of the Learning Sciences (ISLS)","Exploring how novice teachers learn to attend to students in analyzing case studies of classroom teaching and learning","Full Papers"
"3c868b55-8eb8-4197-994f-e398b07a05f1","1/2635","Halverson, Erica Rosenfeld","2020-01-09T14:07:38Z","2020-01-08T21:54:46Z","2020-01-09T14:07:38Z","2020-01-08T21:54:46Z","2010-06","In this paper, I take a distributed cognition framework to analyze the tasks of artistic production in terms of the external representations produced. Using data collected through case studies with four youth media arts organizations (YMAOs), I ask how the digital art-making process can be understood in terms of the construction of external representations and what function these representations serve in art- making. I analyze data on the process of making digital art in terms of the macro and micro tasks performed (Spillane, Halverson, &amp; Diamond, 2001) in order to highlight external representation construction across organizations. Then I describe one micro task in depth to unpack the role the representations created serve in sensemaking. I find that digital art-making as structured in YMAOs seems to provide a robust, authentic environment for the construction of process-based external representations which has implications for content domains that value representation as a learning goal.","Made available in DSpace on 2020-01-09T14:07:38Z (GMT). No. of bitstreams: 1
412-419.pdf: 266288 bytes, checksum: 9e29125091715352b91d932482488325 (MD5)
  Previous issue date: 2010-06","Halverson, E. R. (2010). Digital art-making as a representational process. In Gomez, K., Lyons, L., & Radinsky, J. (Eds.), Learning in the Disciplines: Proceedings of the 9th International Conference of the Learning Sciences (ICLS 2010) - Volume 1, Full Papers (pp. 412-419). Chicago IL: International Society of the Learning Sciences.","https://repository.isls.org//handle/1/2702","https://doi.dx.org/10.22318/icls2010.1.412","en","International Society of the Learning Sciences (ISLS)","Digital art-making as a representational process","Full Papers"
"070d43f6-1ea5-407b-b83c-3d80055b5c0c","1/2635","Danish, Joshua||Phelps, David","2020-01-09T14:07:39Z","2020-01-08T21:54:47Z","2020-01-09T14:07:39Z","2020-01-08T21:54:47Z","2010-06","A productive approach to studying the role of representations in supporting students' learning of science content is to examine their representational practices. The current study examines kindergarten and first-grade students' representational practices in a similar context--the creation of storyboards--both before and after a curricular intervention in order to highlight those aspects of their practices that changed while engaging in a superficially similar task. Analysis of the students' storyboards reveals considerable improvement after the intervention. Analysis of the students' practices as they changed over time is also presented by examining the students' interactions, with a focus on their discussions of the science content and the representations themselves.","Made available in DSpace on 2020-01-09T14:07:39Z (GMT). No. of bitstreams: 1
420-427.pdf: 245781 bytes, checksum: e26b55fe21f6b078d3955da53f51997b (MD5)
  Previous issue date: 2010-06","Danish, J. & Phelps, D. (2010). Kindergarten and First-Grade Students' Representational Practices While Creating Storyboards of Honeybees Collecting Nectar. In Gomez, K., Lyons, L., & Radinsky, J. (Eds.), Learning in the Disciplines: Proceedings of the 9th International Conference of the Learning Sciences (ICLS 2010) - Volume 1, Full Papers (pp. 420-427). Chicago IL: International Society of the Learning Sciences.","https://repository.isls.org//handle/1/2703","https://doi.dx.org/10.22318/icls2010.1.420","en","International Society of the Learning Sciences (ISLS)","Kindergarten and First-Grade Students' Representational Practices While Creating Storyboards of Honeybees Collecting Nectar","Full Papers"
"af7ca6e4-e50f-4691-bb78-573ebc18135f","1/2635","Berland, Leema||Forte, Andrea","2020-01-09T14:07:39Z","2020-01-08T21:54:48Z","2020-01-09T14:07:39Z","2020-01-08T21:54:48Z","2010-06","Does a speaker craft an argument carefully if no one will hear it? Does an engineer design structures without reflecting on the individuals for whom her creations will have meaning and utility? Learning sciences research often explores such creative activities as meaningful opportunities for learning--inherent in these acts of creation is the concept of audience. In this paper, we draw on the philosophical and science studies literature to further unpack the role of audience in argumentation and examine three different ways that educators have addressed the problem of creating an audience for student work. We discuss how these approaches can challenge existing classroom structures and present evidence from empirical studies that demonstrate some of the outcomes.","Made available in DSpace on 2020-01-09T14:07:39Z (GMT). No. of bitstreams: 1
428-435.pdf: 255933 bytes, checksum: 497367f02fbcfaab913c22af352620e4 (MD5)
  Previous issue date: 2010-06","Berland, L. & Forte, A. (2010). When Students Speak, Who Listens? Constructing Audience in Classroom Argumentation. In Gomez, K., Lyons, L., & Radinsky, J. (Eds.), Learning in the Disciplines: Proceedings of the 9th International Conference of the Learning Sciences (ICLS 2010) - Volume 1, Full Papers (pp. 428-435). Chicago IL: International Society of the Learning Sciences.","https://repository.isls.org//handle/1/2704","https://doi.dx.org/10.22318/icls2010.1.428","en","International Society of the Learning Sciences (ISLS)","When Students Speak, Who Listens? Constructing Audience in Classroom Argumentation","Full Papers"
"3e609225-73af-4e37-8ebf-0296cf537561","1/2635","Wen, Yun||Chen, Wenli||Looi, Chee-Kit","2020-01-09T14:07:39Z","2020-01-08T21:54:49Z","2020-01-09T14:07:39Z","2020-01-08T21:54:49Z","2010-06","Drawing from sociocultural perspectives, this paper argues for the necessity of distinguishing the activity of ""brainstorming idea""s from the activity of ""generating words/phrases""ni collaborative L2 process writing. We designed a seires of Chinese writing lessons based on the online collaborative learning software GroupScribbles (GS) to explore students' participation and performance with ""ideas first"" versus ""words/phrasse first"" activity designs. Quantitative data collected from an analytical tool reveal that students engaged more actively in the ""ideas first"" collaborative L2 writing than in the ""words/phrasesfirst"" approach. Our research findings suggest that ""ideas first"" supported by the affordances of the GS tools a viable approach for collaborative L2 writing.","Made available in DSpace on 2020-01-09T14:07:39Z (GMT). No. of bitstreams: 1
436-443.pdf: 764144 bytes, checksum: ae0963e5234a33c1fe9762c3d959e3b4 (MD5)
  Previous issue date: 2010-06","Wen, Y., Chen, W., & Looi, C. (2010). ""Ideas First"" in Collaborative Second Language (L2) Writing: An Exploratory Study. In Gomez, K., Lyons, L., & Radinsky, J. (Eds.), Learning in the Disciplines: Proceedings of the 9th International Conference of the Learning Sciences (ICLS 2010) - Volume 1, Full Papers (pp. 436-443). Chicago IL: International Society of the Learning Sciences.","https://repository.isls.org//handle/1/2705","https://doi.dx.org/10.22318/icls2010.1.436","en","International Society of the Learning Sciences (ISLS)","""Ideas First"" in Collaborative Second Language (L2) Writing: An Exploratory Study","Full Papers"
"cea0b7c3-271a-4efc-a3b2-83fbfa6b2330","1/2635","Shechtman, Nicole||Roschelle, Jeremy","2020-01-09T14:07:40Z","2020-01-08T21:54:50Z","2020-01-09T14:07:40Z","2020-01-08T21:54:50Z","2010-06","As Learning Sciencebased innovations are studied at scale, traditional Learning Sciences methods such as video analysis and classroom observation become impractical. Yet Learning Scientists want to know more about student misconceptions, the connections between writing and conceptual understanding, and classroom practices than pretests and posttests can reveal. In this paper, we discuss an exploratory posthoc analysis of 765 workbooks from 48 classrooms that implemented SimCalc. These classrooms participated in a large-scale experiment in which we found that students learned more advanced mathematics in classrooms that implemented SimCalc. A team of three master teachers coded the workbooks for completeness, correctness, and other impressions. We found characteristics of students' work that predict gain scores, including the first evidence that classic SimCalc activities--writing stories and drawing graphs about motions--impact student learning. We discuss potential implications for large-scale Learning Sciences research.","Made available in DSpace on 2020-01-09T14:07:40Z (GMT). No. of bitstreams: 1
444-451.pdf: 333945 bytes, checksum: cc55e6cae46f450d1aadadfd72a5d60f (MD5)
  Previous issue date: 2010-06","Shechtman, N. & Roschelle, J. (2010). Large Scale Analysis of Student Workbooks: What Can We Learn About Learning?. In Gomez, K., Lyons, L., & Radinsky, J. (Eds.), Learning in the Disciplines: Proceedings of the 9th International Conference of the Learning Sciences (ICLS 2010) - Volume 1, Full Papers (pp. 444-451). Chicago IL: International Society of the Learning Sciences.","https://repository.isls.org//handle/1/2706","https://doi.dx.org/10.22318/icls2010.1.444","en","International Society of the Learning Sciences (ISLS)","Large Scale Analysis of Student Workbooks: What Can We Learn About Learning?","Full Papers"
"ad7d6cf1-8b5d-42d0-ae2b-ec22c151e2a6","1/2635","Gegenfurtner, Andreas||Vauras, Marja||Gruber, Hans||Festner, Dagmar","2020-01-09T14:07:40Z","2020-01-08T21:54:51Z","2020-01-09T14:07:40Z","2020-01-08T21:54:51Z","2010-06","Should the construct `motivation to transfer' used inhuman resource development and management research be also used in learning research? The current study revisited motivation to transfer on a sample of 128 participants of occupational health training. Confirmatory factor analysis and partial least square-sbased path modeling were used to test the hypothesized dimensions and relationships among variables inlcuding social and affective cues on training transfer. Based on a combination of the theory of planned behavior, expectancy theory, and self-determination theory, we validated three dimensions of transfer motivation: autonomous motivation to transfer, controlled motivation to transfer, and intentions to transfer. Results indicate that autonomous motivation was affected by attitudes toward training content and utility reactions; controlled motivation was affected by utility reactions, supervisory support,and social norms. Intentions to transfer mediated the effecst of autonomous motivation on transfer three months after training. Implications of a multidisciplinary perspective combining learning sciences and human resource development are discussed.","Made available in DSpace on 2020-01-09T14:07:40Z (GMT). No. of bitstreams: 1
452-459.pdf: 247047 bytes, checksum: f483ecb50c86a4ca7bff5d7de95c32a7 (MD5)
  Previous issue date: 2010-06","Gegenfurtner, A., Vauras, M., Gruber, H., & Festner, D. (2010). Motivation To Transfer Revisited. In Gomez, K., Lyons, L., & Radinsky, J. (Eds.), Learning in the Disciplines: Proceedings of the 9th International Conference of the Learning Sciences (ICLS 2010) - Volume 1, Full Papers (pp. 452-459). Chicago IL: International Society of the Learning Sciences.","https://repository.isls.org//handle/1/2707","https://doi.dx.org/10.22318/icls2010.1.452","en","International Society of the Learning Sciences (ISLS)","Motivation To Transfer Revisited","Full Papers"
"29574ae3-c140-4d58-95dc-005ab64487ef","1/2635","Clark, Dav||Ranney, Michael","2020-01-09T14:07:40Z","2020-01-08T21:54:52Z","2020-01-09T14:07:40Z","2020-01-08T21:54:52Z","2010-06","Conceptual change represents a crucial, challenging, learning component. This study hypothesized and observed evidence for two parallel forms of learning within the Numerically-Driven Inferencing (NDI) paradigm's rather minimalist intervention of providing direct feedback regarding a numerical estimatefeedback that yields remarkably robust cognitive alterations. The present experiment probed the nature of learning apropos recall or estimation improvements observed after participants (a) provided estimates, (b) received feedback, and (c) re-estimated after waiting for one day. The results show that improved estimation/recall was predicted by two independent elementssurprise at feedback and an explicit sense of episodic recall upon testing. This suggests at least two learning processes: (1) an explicit (though perhaps approximate) recollection of a quantity's magnitude and (2) a non- episodic semantic restructuring that correlates with surprise. Thus, even for concise, factual information, we educators might consider students' ""unknown knowns"" knowledge that learners gain without any explicit understanding that they have done so.","Made available in DSpace on 2020-01-09T14:07:40Z (GMT). No. of bitstreams: 1
460-467.pdf: 461468 bytes, checksum: de68958071d96f28f53d2e96d7f16d13 (MD5)
  Previous issue date: 2010-06","Clark, D. & Ranney, M. (2010). Known Knowns and Unknown Knowns: Multiple Memory Routes to Improved Numerical Estimation. In Gomez, K., Lyons, L., & Radinsky, J. (Eds.), Learning in the Disciplines: Proceedings of the 9th International Conference of the Learning Sciences (ICLS 2010) - Volume 1, Full Papers (pp. 460-467). Chicago IL: International Society of the Learning Sciences.","https://repository.isls.org//handle/1/2708","https://doi.dx.org/10.22318/icls2010.1.460","en","International Society of the Learning Sciences (ISLS)","Known Knowns and Unknown Knowns: Multiple Memory Routes to Improved Numerical Estimation","Full Papers"
"60e71580-f25f-4f3c-84be-55e255008e1b","1/2635","Ronen-Fuhrmann, Tamar||Kali, Yael","2020-01-09T14:07:41Z","2020-01-08T21:54:53Z","2020-01-09T14:07:41Z","2020-01-08T21:54:53Z","2010-06","This research explored the nature of design knowledge by examining the processes in which graduate students in education learned to design educational technologies. We developed two rubrics to assess: (a) the degree to which students were able to translate their design ideas into concrete design artifacts (concretization rubric), and (b) the degree to which they designed artifacts that followed a socio-constructivist pedagogical approach versus a teacher-centered transmissionst model (epistemology rubric). Outcomes indicated that as students developed their concretization skills, they were able to become aware to and reduce gaps between their ""theoretical"" and ""applied"" epistemologies. By making their design ideas more concrete, students were able to carry out productive negotiations about these ideas with instructors and peers, and to explore them in relation to theory and to expert design knowledge.","Made available in DSpace on 2020-01-09T14:07:41Z (GMT). No. of bitstreams: 1
468-475.pdf: 422370 bytes, checksum: 3fbfc1af1abfc8ba61e1a076267cb28e (MD5)
  Previous issue date: 2010-06","Ronen-Fuhrmann, T. & Kali, Y. (2010). The Role of Concretization in Acquiring Design Knowledge. In Gomez, K., Lyons, L., & Radinsky, J. (Eds.), Learning in the Disciplines: Proceedings of the 9th International Conference of the Learning Sciences (ICLS 2010) - Volume 1, Full Papers (pp. 468-475). Chicago IL: International Society of the Learning Sciences.","https://repository.isls.org//handle/1/2709","https://doi.dx.org/10.22318/icls2010.1.468","en","International Society of the Learning Sciences (ISLS)","The Role of Concretization in Acquiring Design Knowledge","Full Papers"
"f0b134a3-ee3e-4f24-a7ab-ae0abeede32c","1/2635","Slof, Bert||Erkens, Gijsbert||Kirschner, Paul","2020-01-09T14:07:41Z","2020-01-08T21:54:54Z","2020-01-09T14:07:41Z","2020-01-08T21:54:54Z","2010-06",,"Made available in DSpace on 2020-01-09T14:07:41Z (GMT). No. of bitstreams: 1
476-483.pdf: 410786 bytes, checksum: a6896a7f706472b70bac4b27d145bd8d (MD5)
  Previous issue date: 2010-06","Slof, B., Erkens, G., & Kirschner, P. (2010). Representational Scripting to Support Students' Online Problem-solving Performance. In Gomez, K., Lyons, L., & Radinsky, J. (Eds.), Learning in the Disciplines: Proceedings of the 9th International Conference of the Learning Sciences (ICLS 2010) - Volume 1, Full Papers (pp. 476-483). Chicago IL: International Society of the Learning Sciences.","https://repository.isls.org//handle/1/2710","https://doi.dx.org/10.22318/icls2010.1.476","en","International Society of the Learning Sciences (ISLS)","Representational Scripting to Support Students' Online Problem-solving Performance","Full Papers"
"a41f7b98-f6a9-44b9-a9b9-27ff186fd327","1/2635","Chen, Wenli||Seow, Peter Sen Kee||So, Hyo-Jeong||Toh, Yancy||Looi, Chee-Kit","2020-01-09T14:07:41Z","2020-01-08T21:54:56Z","2020-01-09T14:07:41Z","2020-01-08T21:54:56Z","2010-06","Learning is interweaved into and across students' everyday life activities. Technology that is used to support learning should be integrated with everyday life in the same way that learning occurs in everyday life: seamlessly. Mobile technologies, with their reduced size and ease of use, provide the potential to extend students' learning spaces and enrich the learning experiences in their daily lives where they move between locations, switch from one topic or context to another, and interact with different social groups. This paper proposes mobile technology-supported seamless learning and presents learning scenarios from our research to illustrate how learning occurs seamlessly across time and places mediated by mobile devices.","Made available in DSpace on 2020-01-09T14:07:41Z (GMT). No. of bitstreams: 1
484-491.pdf: 319499 bytes, checksum: abbef42090aab508a5cacc37f68d19b2 (MD5)
  Previous issue date: 2010-06","Chen, W., Seow, P. S., So, H., Toh, Y., & Looi, C. (2010). Extending Students' learning Spaces: Technology-Supported Seamless Learning. In Gomez, K., Lyons, L., & Radinsky, J. (Eds.), Learning in the Disciplines: Proceedings of the 9th International Conference of the Learning Sciences (ICLS 2010) - Volume 1, Full Papers (pp. 484-491). Chicago IL: International Society of the Learning Sciences.","https://repository.isls.org//handle/1/2711","https://doi.dx.org/10.22318/icls2010.1.484","en","International Society of the Learning Sciences (ISLS)","Extending Students' learning Spaces: Technology-Supported Seamless Learning","Full Papers"
"bda87574-7884-40ae-ba1a-745f5e1b0417","1/2635","Zhang, Jianwei||Messina, Richard","2020-01-09T14:07:42Z","2020-01-08T21:54:01Z","2020-01-09T14:07:42Z","2020-01-08T21:54:01Z","2010-06","This study elaborates collaborative productivity as self-sustaining processes along with the role of the teacher in a knowledge building community. The participants were 22 fourth-graders, who investigated light over a three-month period facilitated by a veteran teacher with the support of Knowledge Forum!. Content analysis of the students' portfolios indicates significant advancement of understanding. Qualitative analysis of classroom videos, online discourse, and the teacher's reflection journal identifies community interactions and teacher scaffolding related to four interrelated processes. These include: (a) accumulating a highly variable stock of information and ideas and mobilizing information connection; (b) sustained, incremental idea development; (c) critical examination and selection of ideas; and (d) distributed emergent control. These processes elaborate self-organization mechanisms underpinning collaborative productivity, informing new ways to scaffold knowledge building.","Made available in DSpace on 2020-01-09T14:07:42Z (GMT). No. of bitstreams: 1
49-56.pdf: 239774 bytes, checksum: 3f57faa770e5d5d79280d755e7662c10 (MD5)
  Previous issue date: 2010-06","Zhang, J. & Messina, R. (2010). Collaborative Productivity as Self-Sustaining Processes in a Grade 4 Knowledge Building Community. In Gomez, K., Lyons, L., & Radinsky, J. (Eds.), Learning in the Disciplines: Proceedings of the 9th International Conference of the Learning Sciences (ICLS 2010) - Volume 1, Full Papers (pp. 49-56). Chicago IL: International Society of the Learning Sciences.","https://repository.isls.org//handle/1/2712","https://doi.dx.org/10.22318/icls2010.1.49","en","International Society of the Learning Sciences (ISLS)","Collaborative Productivity as Self-Sustaining Processes in a Grade 4 Knowledge Building Community","Full Papers"
"e8c30905-a706-499d-94b6-827665c6a569","1/2635","Abrahamson, Dor","2020-01-09T14:07:42Z","2020-01-08T21:54:57Z","2020-01-09T14:07:42Z","2020-01-08T21:54:57Z","2010-06","We discuss a brief transcribed excerpt from a task-based interview with Li, an 11.5-year-old participant in a design-based research study of probabilistic cognition pertaining to the binomial. We investigate whether and how Li made sense of the behavior of an unfamiliar computer-based artifact--the diminishing proportional impact of successive random samples on the overall shape of a dynamically accumulating outcome distribution. Li constructed two informal analogical situations as multimodal discursive means of concretizing, elaborating, and communicating his emerging understanding of the artifact's behavior. These non-routine utterances shifted the discourse to an explicitly embodied, imagistic space bearing unique affordances for negotiated epistemic syntheses of phenomenological and technological constructions of quantitative relations. Microgenetic analysis suggests that Li's presymbolic notion was not a static magnitude but an intensive-quantity ""actionobject""; he subsequently unpacked this dynamical ""a/b"" qualia into its constitutive ""a"" and ""b"" elements. We reflect on implications of this counter-curricular sequence for educational design.","Made available in DSpace on 2020-01-09T14:07:42Z (GMT). No. of bitstreams: 1
492-499.pdf: 374470 bytes, checksum: 3949b09924cd4f394bd38fc537df058d (MD5)
  Previous issue date: 2010-06","Abrahamson, D. (2010). A Tempest in a Teapot Is but a Drop in the Ocean: Action-Objects in Analogical Mathematical Reasoning. In Gomez, K., Lyons, L., & Radinsky, J. (Eds.), Learning in the Disciplines: Proceedings of the 9th International Conference of the Learning Sciences (ICLS 2010) - Volume 1, Full Papers (pp. 492-499). Chicago IL: International Society of the Learning Sciences.","https://repository.isls.org//handle/1/2713","https://doi.dx.org/10.22318/icls2010.1.492","en","International Society of the Learning Sciences (ISLS)","A Tempest in a Teapot Is but a Drop in the Ocean: Action-Objects in Analogical Mathematical Reasoning","Full Papers"
"8201147a-6dcc-4c2b-b3ec-864545dec4df","1/2635","Boticki, Ivica||So, Hyo-Jeong","2020-01-09T14:07:42Z","2020-01-08T21:54:58Z","2020-01-09T14:07:42Z","2020-01-08T21:54:58Z","2010-06",,"Made available in DSpace on 2020-01-09T14:07:42Z (GMT). No. of bitstreams: 1
500-507.pdf: 515323 bytes, checksum: 4d767ab1cb9018cf4ebc8e6fa658d503 (MD5)
  Previous issue date: 2010-06","Boticki, I. & So, H. (2010). Quiet Captures: A Tool for Capturing the Evidence of Seamless Learning with Mobile Devices. In Gomez, K., Lyons, L., & Radinsky, J. (Eds.), Learning in the Disciplines: Proceedings of the 9th International Conference of the Learning Sciences (ICLS 2010) - Volume 1, Full Papers (pp. 500-507). Chicago IL: International Society of the Learning Sciences.","https://repository.isls.org//handle/1/2714","https://doi.dx.org/10.22318/icls2010.1.500","en","International Society of the Learning Sciences (ISLS)","Quiet Captures: A Tool for Capturing the Evidence of Seamless Learning with Mobile Devices","Full Papers"
