id,collection,dc.contributor.author,dc.contributor.author[],dc.date.accessioned,dc.date.accessioned[],dc.date.available,dc.date.available[],dc.date.issued,dc.date.issued[],dc.description.abstract[en_US],dc.description.provenance[en],dc.identifier.citation[en_US],dc.identifier.uri,dc.identifier.uri[],dc.language.iso[en_US],dc.publisher[en_US],dc.title[en_US],dc.type[en_US]
"a096e3c9-21a0-4474-8c8c-7242b63042be","1/98",,"Heimbuch, Sven||Bodemer, Daniel","2017-06-19T09:42:46Z","2017-06-19T11:35:58Z","2017-06-19T09:42:46Z","2017-06-19T11:35:58Z",,"2016-07","Learning within the scope of collaborative knowledge construction with Wikis offers opportunities for triggering socio-cognitive conflicts through controversies. Since the nature of discussions between users in Wikis is not easily recognisable, we were investigating the effects of visual highlighting as controversy awareness information. In this study we wanted to enable N = 81 participants to produce contributions of higher quality due to focused selection towards relevant contents. We conducted both qualitative and quantitative analyses on Wiki contributions. The addition of visual highlights indicating controversies reinforced students to direct their attention towards important contents discussing the study’s subject matter. When their selection behaviour was positively influenced it resulted in higher quality and more elaborate contributions to discussion threads and to the final revision of an article. We conclude that unobtrusive implicit guidance can facilitate collaborative knowledge construction processes and outcomes.","Made available in DSpace on 2017-06-19T09:42:46Z (GMT). No. of bitstreams: 1
133.pdf: 376754 bytes, checksum: d7c02b820138768f84ec3f597526e9a5 (MD5)
  Previous issue date: 2016-07","Heimbuch, S. & Bodemer, D. (2016). Effects of Implicit Guidance on Contribution Quality in a Wiki-Based Learning Environment In Looi, C. K., Polman, J. L., Cress, U., and Reimann, P. (Eds.). Transforming Learning, Empowering Learners: The International Conference of the Learning Sciences (ICLS) 2016, Volume 2. Singapore: International Society of the Learning Sciences.","https://repository.isls.org/handle/1/340","https://doi.dx.org/10.22318/icls2016.133","en","Singapore: International Society of the Learning Sciences","Effects of Implicit Guidance on Contribution Quality in a Wiki-Based Learning Environment","Book chapter"
"4c592d6f-775c-40d7-8dcc-d8636d000d95","1/98",,"Liu, Shiyu","2017-06-19T09:42:46Z","2017-06-19T11:35:59Z","2017-06-19T09:42:46Z","2017-06-19T11:35:59Z",,"2016-07","The present study explored how peer assessment may influence the development of students’ skills in constructing written arguments. Twenty-two college freshmen participated in this qualitative research to provide feedback on their peer’s written arguments about popular psychology topics. Constant comparative analysis of multiple data sources revealed three main categories of feedback that students provided: cognition-based, metacognition-based, and affection-based. While receiving cognition-based feedback had the most impacts on how students would later evaluate others’ work, those who had previously provided metacognition-based feedback were more likely to make observed progress in constructing arguments. This work adds to our understanding about the complex nature of peer assessment and proposes a potentially effective approach to facilitate students’ skills in written argumentation.","Made available in DSpace on 2017-06-19T09:42:46Z (GMT). No. of bitstreams: 1
134.pdf: 394186 bytes, checksum: 1edc98ec63fd067e67cfde0e642dc431 (MD5)
  Previous issue date: 2016-07","Liu, S. (2016). Learning to Argue: The Role of Peer Assessment In Looi, C. K., Polman, J. L., Cress, U., and Reimann, P. (Eds.). Transforming Learning, Empowering Learners: The International Conference of the Learning Sciences (ICLS) 2016, Volume 2. Singapore: International Society of the Learning Sciences.","https://repository.isls.org/handle/1/341","https://doi.dx.org/10.22318/icls2016.134","en","Singapore: International Society of the Learning Sciences","Learning to Argue: The Role of Peer Assessment","Book chapter"
"2b60bb44-cbb4-4490-8257-5a6e374d0f35","1/98",,"Nistor, Nicolae||Dascălu, Mihai||Trăușan-Matu, Ștefan","2017-06-19T09:42:47Z","2017-06-19T11:36:00Z","2017-06-19T09:42:47Z","2017-06-19T11:36:00Z",,"2016-07","Using online knowledge communities (OKCs) as informal learning environments poses the question how likely these will integrate newcomers as peripheral participants. Previous research has identified surface characteristics of the OKC dialog as integrativity predictors. Yet, little is known about the role of dialogic textual complexity. This contribution proposes a comprehensive approach based on previously validated textual complexity indexes and applies it to predict OKC integrativity. The dialog analysis of N = 14 blogger communities with a total of 1937 participants identified three main components of textual complexity: dialog participation, structure and cohesion. From these, dialog cohesion was higher in integrative OKCs, thus significantly predicting OKC integrativity. This result adds to previous OKC research by uncovering the depth of OKC discourse. For educational practice, the study suggests a way of empowering learners by automatically assessing the integrativity of OKCs in which they may attempt to participate and access community knowledge.","Made available in DSpace on 2017-06-19T09:42:47Z (GMT). No. of bitstreams: 1
135.pdf: 410173 bytes, checksum: d1a3a0b50464134c8845112c48b2e229 (MD5)
  Previous issue date: 2016-07","Nistor, N., Dascălu, M., & Trăușan-Matu, Ș. (2016). Newcomer Integration in Online Knowledge Communities: Exploring the Role of Dialogic Textual Complexity In Looi, C. K., Polman, J. L., Cress, U., and Reimann, P. (Eds.). Transforming Learning, Empowering Learners: The International Conference of the Learning Sciences (ICLS) 2016, Volume 2. Singapore: International Society of the Learning Sciences.","https://repository.isls.org/handle/1/342","https://doi.dx.org/10.22318/icls2016.135","en","Singapore: International Society of the Learning Sciences","Newcomer Integration in Online Knowledge Communities: Exploring the Role of Dialogic Textual Complexity","Book chapter"
"f43c3166-d61d-4bdd-8ea2-bdf172aa6527","1/98",,"Kyewski, Elias||Krämer, Nicole C.||Christmann, Nina||Elson, Malte||Erdmann, Julia||Hecking, Tobias||Herrmann, Thomas||Hoppe, H. Ulrich||Rummel, Nikol||Wichmann, Astrid","2017-06-19T09:42:48Z","2017-06-19T11:36:01Z","2017-06-19T09:42:48Z","2017-06-19T11:36:01Z",,"2016-07","The paper analyzes students’ experience within a large scale e-learning course in a higher education setting. During the course students worked on successive assignments individually or in groups of three students in an alternating fashion. Captured data include students’ platform behavior (login, resource accesses, e.g., literature access, video access, active days, completed quizzes, resource coverage), students’ final course grade as well as learning preferences, intrinsic motivation and satisfaction assessed via questionnaire. Results reveal that of those variables the satisfaction with the collaborative tasks is merely related to students’ overall course evaluation.","Made available in DSpace on 2017-06-19T09:42:48Z (GMT). No. of bitstreams: 1
136.pdf: 357599 bytes, checksum: 900037512fbc1ad512a0a5c7f4c79bf6 (MD5)
  Previous issue date: 2016-07","Kyewski, E., Krämer, N. C., Christmann, N., Elson, M., Erdmann, J., Hecking, T., Herrmann, T., Hoppe, H. U., Rummel, N., & Wichmann, A. (2016). Is Small Group Collaboration Beneficial in Large Scale Online Courses? An Investigation of Factors Influencing Satisfaction and Performance in GroupMOOCs In Looi, C. K., Polman, J. L., Cress, U., and Reimann, P. (Eds.). Transforming Learning, Empowering Learners: The International Conference of the Learning Sciences (ICLS) 2016, Volume 2. Singapore: International Society of the Learning Sciences.","https://repository.isls.org/handle/1/343","https://doi.dx.org/10.22318/icls2016.136","en","Singapore: International Society of the Learning Sciences","Is Small Group Collaboration Beneficial in Large Scale Online Courses? An Investigation of Factors Influencing Satisfaction and Performance in GroupMOOCs","Book chapter"
"404b0878-3fe9-4a4f-903f-f42859cfdd1d","1/98",,"Tan, Michael","2017-06-19T09:42:49Z","2017-06-19T11:36:02Z","2017-06-19T09:42:49Z","2017-06-19T11:36:02Z",,"2016-07","In creative problem solving, an essential component is the divergent idea generation phase before deciding on a plan of action for convergent, relatively well structured problem solving. In makerspaces and other sites where problems are posed in physical form, the material affordances of the objects and their spatial configurations can aid or hinder the search through problem space for possible solutions. In this study, we present the preliminary results of a study involving six pairs of grade eight students involved in a school makerspace context. Given sixteen littleBits modules housed in a small toolbox, along with some light construction materials, students were tasked to produce a prototype of a device that could attract teachers’ attention during class work sessions. The material actions that students made in early explora-tion of project ideas were correlated to the creative outcomes of their project.","Made available in DSpace on 2017-06-19T09:42:49Z (GMT). No. of bitstreams: 1
137.pdf: 434535 bytes, checksum: 9b992b377d63b25791c39554bbcbce12 (MD5)
  Previous issue date: 2016-07","Tan, M. (2016). Embodied Search Processes in Creative Problem Solving: How Do People Learn in Makerspaces? In Looi, C. K., Polman, J. L., Cress, U., and Reimann, P. (Eds.). Transforming Learning, Empowering Learners: The International Conference of the Learning Sciences (ICLS) 2016, Volume 2. Singapore: International Society of the Learning Sciences.","https://repository.isls.org/handle/1/344","https://doi.dx.org/10.22318/icls2016.137","en","Singapore: International Society of the Learning Sciences","Embodied Search Processes in Creative Problem Solving: How Do People Learn in Makerspaces?","Book chapter"
"d11a71a6-a80b-4131-9848-c3c400bd07d5","1/98",,"Mazziotti, Claudia||Rummel, Nikol||Deiglmayr, Anne","2017-06-19T09:42:49Z","2017-06-19T11:36:04Z","2017-06-19T09:42:49Z","2017-06-19T11:36:04Z",,"2016-07","In this article we focus on evaluating student solutions generated during the initial problem-solving phase of a Productive Failure study, where problem solving precedes instruction. In particular, we investigated whether collaboratively learning students came up with more solution ideas and generated qualitatively better solutions than individually learning students. Although descriptively the collaboratively learning students outperformed individually learning students with regard to both the quantity of solution ideas and the quality of solutions, we were unable to establish statistically significant differences. Moreover, we did not find correlations between students’ solutions and their learning outcome. Possible reasons for the missing link are discussed. The analyses reported in this paper are based on yet unpublished data from a study by Mazziotti, Loibl & Rummel (2015).","Made available in DSpace on 2017-06-19T09:42:49Z (GMT). No. of bitstreams: 1
138.pdf: 402595 bytes, checksum: c1f52ce822b67b4de7377502da7df3f8 (MD5)
  Previous issue date: 2016-07","Mazziotti, C., Rummel, N., & Deiglmayr, A. (2016). Comparing Students’ Solutions When Learning Collaboratively or Individually Within Productive Failure In Looi, C. K., Polman, J. L., Cress, U., and Reimann, P. (Eds.). Transforming Learning, Empowering Learners: The International Conference of the Learning Sciences (ICLS) 2016, Volume 2. Singapore: International Society of the Learning Sciences.","https://repository.isls.org/handle/1/345","https://doi.dx.org/10.22318/icls2016.138","en","Singapore: International Society of the Learning Sciences","Comparing Students’ Solutions When Learning Collaboratively or Individually Within Productive Failure","Book chapter"
"f9588348-16c0-427a-a43c-88efb1584b1c","1/98",,"Bertram, Charles||Leak, Anne||Sayre, Eleanor C.||Kustusch, Mary Bridget||Franklin, Scott V.","2017-06-19T09:42:50Z","2017-06-19T11:36:05Z","2017-06-19T09:42:50Z","2017-06-19T11:36:05Z",,"2016-07","We report on student beliefs about what constitutes expertise. Our population is a group of first-generation and deaf/hard-of-hearing students participating in a pre-matriculation university program designed to encourage reflection and metacognitive practice. Students first worked in small groups to articulate criteria that defined expertise and then engaged in a class discussion in which a formal definition was developed. All activities were recorded and student discourse analyzed, revealing a nuanced and evolving understanding of expertise.","Made available in DSpace on 2017-06-19T09:42:50Z (GMT). No. of bitstreams: 1
139.pdf: 450166 bytes, checksum: 99030799ac3bc0b0eeedc500c0781e12 (MD5)
  Previous issue date: 2016-07","Bertram, C., Leak, A., Sayre, E. C., Kustusch, M. B., & Franklin, S. V. (2016). Student Conceptions of Expertise In Looi, C. K., Polman, J. L., Cress, U., and Reimann, P. (Eds.). Transforming Learning, Empowering Learners: The International Conference of the Learning Sciences (ICLS) 2016, Volume 2. Singapore: International Society of the Learning Sciences.","https://repository.isls.org/handle/1/346","https://doi.dx.org/10.22318/icls2016.139","en","Singapore: International Society of the Learning Sciences","Student Conceptions of Expertise","Book chapter"
"f0e7749d-ceaf-4225-a293-16c0ed831c50","1/98",,"Laina, Vasiliki||Wilkerson, Michelle","2017-06-19T09:42:51Z","2017-06-19T11:36:06Z","2017-06-19T09:42:51Z","2017-06-19T11:36:06Z",,"2016-07","Data visualizations are transforming how information is communicated. Educators should understand and support how youth reason about these complex representational artifacts. We analyze an interview in which young learners interpreted an interactive visualization as describing both relative distribution and absolute trends, and resolved conflicts related to this dual interpretation by re-aligning mathematical and personal knowledge. This case reflects a need for attention to multidimensional data and narrative design in research on data visualization literacy.","Made available in DSpace on 2017-06-19T09:42:51Z (GMT). No. of bitstreams: 1
140.pdf: 447495 bytes, checksum: 6c268d56a0da165c3294249b6896d796 (MD5)
  Previous issue date: 2016-07","Laina, V. & Wilkerson, M. (2016). Distributions, Trends, and Contradictions: A Case Study in Sensemaking With Interactive Data Visualizations In Looi, C. K., Polman, J. L., Cress, U., and Reimann, P. (Eds.). Transforming Learning, Empowering Learners: The International Conference of the Learning Sciences (ICLS) 2016, Volume 2. Singapore: International Society of the Learning Sciences.","https://repository.isls.org/handle/1/347","https://doi.dx.org/10.22318/icls2016.140","en","Singapore: International Society of the Learning Sciences","Distributions, Trends, and Contradictions: A Case Study in Sensemaking With Interactive Data Visualizations","Book chapter"
"da2e50fc-290b-4cb4-afe1-3a7d31017c2e","1/98",,"Lerner, Patrick||Csanadi, Andras||Daxenberger, Johannes||Flekova, Lucie||Ghanem, Christian||Kollar, Ingo||Fischer, Frank||Gurevych, Iryna","2017-06-19T09:42:51Z","2017-06-19T11:36:08Z","2017-06-19T09:42:51Z","2017-06-19T11:36:08Z",,"2016-07","Scientific reasoning and argumentation (SRA) is a complex process. Thus, analyzing the quality of learners’ SRA and presenting SRA outcomes are important research problems. This study attempts to account for these problems by developing a user interface that facilitates learning scientists to analyze SRA, enabling them to evaluate the performance of an automated coding algorithm and supporting them to recognize patterns in the coded data using flexible visualizations. The usability and the comprehensibility of the user interface have been tested by means of a user study in an online performance test. The results indicate that the user interface effectively supports the investigation of SRA.","Made available in DSpace on 2017-06-19T09:42:51Z (GMT). No. of bitstreams: 1
141.pdf: 463264 bytes, checksum: 214fa3764d62701db5fa8720a44ad174 (MD5)
  Previous issue date: 2016-07","Lerner, P., Csanadi, A., Daxenberger, J., Flekova, L., Ghanem, C., Kollar, I., Fischer, F., & Gurevych, I. (2016). A User Interface for the Exploration of Manually and Automatically Coded Scientific Reasoning and Argumentation In Looi, C. K., Polman, J. L., Cress, U., and Reimann, P. (Eds.). Transforming Learning, Empowering Learners: The International Conference of the Learning Sciences (ICLS) 2016, Volume 2. Singapore: International Society of the Learning Sciences.","https://repository.isls.org/handle/1/348","https://doi.dx.org/10.22318/icls2016.141","en","Singapore: International Society of the Learning Sciences","A User Interface for the Exploration of Manually and Automatically Coded Scientific Reasoning and Argumentation","Book chapter"
"5e1b2d12-adcf-4b9c-b59c-7a851415ff8a","1/98",,"Zimmerman, Heather Toomey||Land, Susan M.||Maggiore, Chrystal||Ashley, Robert W.||Millet, Chris","2017-06-19T09:42:52Z","2017-06-19T11:36:09Z","2017-06-19T09:42:52Z","2017-06-19T11:36:09Z",,"2016-07","This paper presents a collective case study of learners using mobile technology to engage in place-based science learning in an Arboretum. Our work investigates how proximity-based computing mediates youth’s engagement in scientific observations and conversations in their Appalachian community. We draw upon theory from informal learning, place-based learning, and context-sensitive educational technologies to inform the research. Data from 26 children in a summer camp program include log files, field notes, and video-records. Our findings illustrate how an iBeacon system supported children’s playful and scientific engagement (including in observational practices). We provide insights into designing for learner-centered mobile computing that moves beyond presenting just-in-time information to creating digital-physical spaces where learners engage each other and natural objects to support their interests in science.","Made available in DSpace on 2017-06-19T09:42:52Z (GMT). No. of bitstreams: 1
142.pdf: 445454 bytes, checksum: d04e10f47affff6a25c8286ed5be4e16 (MD5)
  Previous issue date: 2016-07","Zimmerman, H. T., Land, S. M., Maggiore, C., Ashley, R. W., & Millet, C. (2016). Designing Outdoor Learning Spaces With iBeacons: Combining Place-Based Learning With the Internet of Learning Things In Looi, C. K., Polman, J. L., Cress, U., and Reimann, P. (Eds.). Transforming Learning, Empowering Learners: The International Conference of the Learning Sciences (ICLS) 2016, Volume 2. Singapore: International Society of the Learning Sciences.","https://repository.isls.org/handle/1/349","https://doi.dx.org/10.22318/icls2016.142","en","Singapore: International Society of the Learning Sciences","Designing Outdoor Learning Spaces With iBeacons: Combining Place-Based Learning With the Internet of Learning Things","Book chapter"
"8f8bfc21-b40a-413e-ae58-5c3fab55949c","1/98",,"Svihla, Vanessa||Kittinger, Liza","2017-06-19T09:42:53Z","2017-06-19T11:36:10Z","2017-06-19T09:42:53Z","2017-06-19T11:36:10Z",,"2016-07","Traditional approaches to schooling can marginalize already vulnerable students, preventing them from learning; we explore how agency might play a role in supporting such students to develop as learners in a project-based high school that employs design pedagogy. We first examine whether agency can explain variance in standardized mathematics scores. Regression analysis indicates home language and agency had a significant effect on mathematics scores. We then turn to data collected through extended participant observation to characterize decisions students make. Based on these, we detail a developmental agency trajectory: dis/engagement agency serves as a covert means for students to learn; makerly agency serves as an entry point for students to explore and develop interests, and designerly agency allows students to take ownership of design problems and learn as they do so.","Made available in DSpace on 2017-06-19T09:42:53Z (GMT). No. of bitstreams: 1
143.pdf: 391931 bytes, checksum: 42b4c1bd974054b1756affa835c21342 (MD5)
  Previous issue date: 2016-07","Svihla, V. & Kittinger, L. (2016). Agentic Trajectories: Development and Learning in a Project-Based High School for Marginalized Students In Looi, C. K., Polman, J. L., Cress, U., and Reimann, P. (Eds.). Transforming Learning, Empowering Learners: The International Conference of the Learning Sciences (ICLS) 2016, Volume 2. Singapore: International Society of the Learning Sciences.","https://repository.isls.org/handle/1/350","https://doi.dx.org/10.22318/icls2016.143","en","Singapore: International Society of the Learning Sciences","Agentic Trajectories: Development and Learning in a Project-Based High School for Marginalized Students","Book chapter"
"c1ec44e7-2ab9-4aa2-943a-5d7a4afc9a26","1/98",,"Gnesdilow, Dana||Fathema, Nafsaniath||Lin, Feng||Kang, Seokmin||Dornfeld, Catherine||Puntambekar, Sadhana","2017-06-19T09:42:53Z","2017-06-19T11:36:11Z","2017-06-19T09:42:53Z","2017-06-19T11:36:11Z",,"2016-07","This study compared middle school students’ science learning and discourse patterns in physical and virtual labs. Students in virtual labs had significantly higher learning gains than students in the physical labs on a pre and post-test content knowledge test. To understand the difference in learning gains, we analyzed the discourse of the students and teacher as they worked in groups during the labs. We found three main categories of discourse: conceptual talk, task-based talk, and teacher scaffolding. Our analysis of discourse showed that students in the virtual group engaged in more conceptual talk than the physical group, while the physical group had more task-based talk. We also found the teacher provided more conceptual scaffolding during virtual labs than physical labs.  \","Made available in DSpace on 2017-06-19T09:42:53Z (GMT). No. of bitstreams: 1
144.pdf: 417826 bytes, checksum: afe440ac90f7eebdc950661e0dff72c3 (MD5)
  Previous issue date: 2016-07","Gnesdilow, D., Fathema, N., Lin, F., Kang, S., Dornfeld, C., & Puntambekar, S. (2016). Exploring Middle School Students’ Science Learning and Discourse in Physical and Virtual Labs In Looi, C. K., Polman, J. L., Cress, U., and Reimann, P. (Eds.). Transforming Learning, Empowering Learners: The International Conference of the Learning Sciences (ICLS) 2016, Volume 2. Singapore: International Society of the Learning Sciences.","https://repository.isls.org/handle/1/351","https://doi.dx.org/10.22318/icls2016.144","en","Singapore: International Society of the Learning Sciences","Exploring Middle School Students’ Science Learning and Discourse in Physical and Virtual Labs","Book chapter"
"e66885c9-ab01-40dd-a757-515713f86fed","1/98",,"Sommer, Stephen||Graville-Smith, Cynthia||Hinojosa, Leighanna||Polman, Joseph","2017-06-19T09:42:54Z","2017-06-19T11:36:13Z","2017-06-19T09:42:54Z","2017-06-19T11:36:13Z",,"2016-07","This short report describes the design and implementation of a two year, iterative curriculum developed to promote science literacies through the creation of news infographics in an informal learning environment. Paid, high school student interns were recruited to identify an issue of personal and social relevance and create infographics that visually represented and communicated the science behind their topic. After several cycles of peer and editorial review, these infographics could be published in an online newsmagazine. Three cycles of data journalism activity with distinct participation and activity structures are described, with considerations of the affordances and constraints of each cycle.","Made available in DSpace on 2017-06-19T09:42:54Z (GMT). No. of bitstreams: 1
145.pdf: 849625 bytes, checksum: ec52b57ab8f0dd2622d6f6048a4ade82 (MD5)
  Previous issue date: 2016-07","Sommer, S., Graville-Smith, C., Hinojosa, L., & Polman, J. (2016). Iterative Curricular Design of Collaborative Infographics for Science Literacy in Informal Learning Spaces In Looi, C. K., Polman, J. L., Cress, U., and Reimann, P. (Eds.). Transforming Learning, Empowering Learners: The International Conference of the Learning Sciences (ICLS) 2016, Volume 2. Singapore: International Society of the Learning Sciences.","https://repository.isls.org/handle/1/352","https://doi.dx.org/10.22318/icls2016.145","en","Singapore: International Society of the Learning Sciences","Iterative Curricular Design of Collaborative Infographics for Science Literacy in Informal Learning Spaces","Book chapter"
