id,collection,dc.contributor.author,dc.contributor.author[],dc.date.accessioned,dc.date.accessioned[],dc.date.available,dc.date.available[],dc.date.issued,dc.date.issued[],dc.description.abstract[en_US],dc.description.provenance[en],dc.identifier.citation[en_US],dc.identifier.uri,dc.identifier.uri[],dc.language.iso[en_US],dc.publisher[en_US],dc.title[en_US],dc.type[en_US]
"741dac58-fde4-4e2d-9aa0-6ef0f9784389","1/98",,"Popov, Vitaliy||van Leeuwen, Anouschka||Buis, Stan C. A.","2017-05-27T14:30:01Z","2017-03-21T12:05:42Z","2017-05-27T14:30:01Z","2017-03-21T12:05:42Z",,"2016-07","Do the simultaneous alignment of student activities (temporal synchronicity) and students successively building on each other's reasoning (transactivity) predict the quality of collaborative learning products? A mixed method approach was used to study 74 first year university students who were randomly assigned to work in dyads on an ill-defined problem of biodiversity collapse in tropical forests within a CSCL setting. The study results revealed that neither temporal synchronicity nor transactivity correlated with the quality of group products. The qualitative analysis of chat transcripts showed the variability between the groups can be explained by group dynamics, students’ prior knowledge, confidence in managing the learning task, collaborative strategy, and communication skills.","Made available in DSpace on 2017-05-27T14:30:01Z (GMT). No. of bitstreams: 1
47.pdf: 281071 bytes, checksum: 3fef0fabc4e6901cf7c7ae3adf321758 (MD5)
  Previous issue date: 2016-07","Popov, V., van Leeuwen, A., & Buis, S. C. (2016). Process and Output: Relation Between Transactivity, Temporal Synchronicity, and Quality of Group Work During CSCL In Looi, C. K., Polman, J. L., Cress, U., and Reimann, P. (Eds.). Transforming Learning, Empowering Learners: The International Conference of the Learning Sciences (ICLS) 2016, Volume 1. Singapore: International Society of the Learning Sciences.","https://repository.isls.org/handle/1/136","https://dx.doi.org/10.22318/icls2016.47","en","Singapore: International Society of the Learning Sciences","Process and Output: Relation Between Transactivity, Temporal Synchronicity, and Quality of Group Work During CSCL","Book chapter"
"2515e66c-6cec-48a3-9bcb-a0319dce7004","1/98",,"Yip, Jason C.||Gonzalez, Carmen||Katz, Vikki","2017-05-27T14:30:02Z","2017-03-21T12:05:42Z","2017-05-27T14:30:02Z","2017-03-21T12:05:42Z",,"2016-07","In the U.S., there is a large proportion of families where one or both parents are English language learners (ELL). Children in these families often serve important roles as brokers, by engaging their linguistic capabilities, cultural familiarity, and technological skills to bridge their families’ access to information resources. Despite the central role that child brokers play, scholars know little about how they search for, interpret, and translate online information. Using data from an exploratory study with Latino youth (ages 11-14) that involved interviews, online search tasks, and group discussions, we investigate the learning processes, challenges, and strategies that youth employ as they broker online information for their ELL parents.","Made available in DSpace on 2017-05-27T14:30:02Z (GMT). No. of bitstreams: 1
48.pdf: 283167 bytes, checksum: 2415e87f7e72379a84a97b9db6dd5f78 (MD5)
  Previous issue date: 2016-07","Yip, J. C., Gonzalez, C., & Katz, V. (2016). The Learning Experiences of Youth Online Information Brokers In Looi, C. K., Polman, J. L., Cress, U., and Reimann, P. (Eds.). Transforming Learning, Empowering Learners: The International Conference of the Learning Sciences (ICLS) 2016, Volume 1. Singapore: International Society of the Learning Sciences.","https://repository.isls.org/handle/1/137","https://dx.doi.org/10.22318/icls2016.48","en","Singapore: International Society of the Learning Sciences","The Learning Experiences of Youth Online Information Brokers","Book chapter"
"18bca204-869a-4a6d-af5d-6d2c53589edf","1/98",,"Deitrick, Elise||Shapiro, R. Benjamin||Gravel, Brian","2017-05-27T14:30:03Z","2017-03-21T12:05:42Z","2017-05-27T14:30:03Z","2017-03-21T12:05:42Z",,"2016-07","We comparatively apply methods for assessing equity to find ways that allow us to better interrogate, describe, and understand the construct’s complexities. To do so, we replicate prior work assessing equity in programming pairs (Lewis & Shah, 2015; Shah, Lewis, & Caires, 2014) by creating distributions of coded (1) computer use, (2) turns of talk, and (3) questions and commands; furthermore we build upon their application by (4) examining students’ embodied interaction and social positioning. Using these four methods to analyze the discourse of a pair of students programming, we identified numerous examples of positioning shifts, and see how inequities could potentially emerge through discursive mechanisms. We then reflect on what each of these four different methods foreground, their strengths and shortcomings, including their sensitivity to time-scope and pedagogy, and triangulate the quantified and qualitative results.","Made available in DSpace on 2017-05-27T14:30:03Z (GMT). No. of bitstreams: 1
49.pdf: 333326 bytes, checksum: 08c4680486a04e8260aa4e8ce8ecba51 (MD5)
  Previous issue date: 2016-07","Deitrick, E., Shapiro, R. B., & Gravel, B. (2016). How Do We Assess Equity in Programming Pairs? In Looi, C. K., Polman, J. L., Cress, U., and Reimann, P. (Eds.). Transforming Learning, Empowering Learners: The International Conference of the Learning Sciences (ICLS) 2016, Volume 1. Singapore: International Society of the Learning Sciences.","https://repository.isls.org/handle/1/138","https://dx.doi.org/10.22318/icls2016.49","en","Singapore: International Society of the Learning Sciences","How Do We Assess Equity in Programming Pairs?","Book chapter"
"ecf413b4-6ddd-4348-838e-ca0db5a1522c","1/98",,"Manches, Andrew||Dragomir, Mihaela","2017-05-27T14:30:04Z","2017-03-21T12:05:42Z","2017-05-27T14:30:04Z","2017-03-21T12:05:42Z",,"2016-07","This paper contributes evidence for the claim that gestures used to support numerical thinking can simulate prior concrete experiences. 114 children aged 6-9 years explained a numerical relationship (additive composition) three times consecutively. All children explained without materials for the 1st and 3rd explanation. For the 2nd explanation, children were randomly assigned to one of three conditions to use: physical objects; a number line; or no materials (control condition) to explain their thinking. Findings showed how using physical objects significantly influenced the particular types of gestures (e.g. splitting), hand morphology (e.g. pinching), and words (e.g. “take”, “big”) that children used in subsequent explanations without materials. Similar (although less pronounced) priming effects were found for the number line condition. The study provides support for conceptual metaphor theory (used to categorize gestures and language), and the potential for gesture research to address long-standing questions concerning the role of concrete materials in learning.","Made available in DSpace on 2017-05-27T14:30:04Z (GMT). No. of bitstreams: 1
50.pdf: 327357 bytes, checksum: b71428df3a0f38ec24e7c43edc023c3a (MD5)
  Previous issue date: 2016-07","Manches, A. & Dragomir, M. (2016). The Effect of Concrete Materials on Children’s Subsequent Numerical Explanations: Metaphorical Priming In Looi, C. K., Polman, J. L., Cress, U., and Reimann, P. (Eds.). Transforming Learning, Empowering Learners: The International Conference of the Learning Sciences (ICLS) 2016, Volume 1. Singapore: International Society of the Learning Sciences.","https://repository.isls.org/handle/1/139","https://dx.doi.org/10.22318/icls2016.50","en","Singapore: International Society of the Learning Sciences","The Effect of Concrete Materials on Children’s Subsequent Numerical Explanations: Metaphorical Priming","Book chapter"
"33ed1706-d72e-4792-aca5-9cdbae09cc4f","1/98",,"Barth-Cohen, Lauren A.||Wittmann, Michael C.","2017-05-27T14:30:04Z","2017-03-21T12:05:42Z","2017-05-27T14:30:04Z","2017-03-21T12:05:42Z",,"2016-07","This article presents an extension to coordination class theory—a theory of conceptual change that was built to capture an individual’s learning in an interview setting. Here we extend that theory to capture group and individual learning in classrooms. The proposed extension focuses on different contexts in the sense of groups’ and individuals’ different interpretations of the same student-generated artifact. A classroom of 9th grade earth science students created embodied models for a specific scientific concept, the steady state energy of the earth. We describes that the students encountered difficulties aligning their embodied models with their conceptual understandings, and yet, they were able to make progress by changing their models to better align their understanding of the scientific concept with their newly modified model—instances of individual and group learning. We conclude with discussing implications for designing classrooms learning environments.","Made available in DSpace on 2017-05-27T14:30:04Z (GMT). No. of bitstreams: 1
51.pdf: 376075 bytes, checksum: f13aada76820f01a126acd3b12e0929e (MD5)
  Previous issue date: 2016-07","Barth-Cohen, L. A. & Wittmann, M. C. (2016). Expanding Coordination Class Theory to Capture Conceptual Learning in a Classroom Environment In Looi, C. K., Polman, J. L., Cress, U., and Reimann, P. (Eds.). Transforming Learning, Empowering Learners: The International Conference of the Learning Sciences (ICLS) 2016, Volume 1. Singapore: International Society of the Learning Sciences.","https://repository.isls.org/handle/1/140","https://dx.doi.org/10.22318/icls2016.51","en","Singapore: International Society of the Learning Sciences","Expanding Coordination Class Theory to Capture Conceptual Learning in a Classroom Environment","Book chapter"
"21816b9f-437b-4a31-9d71-bb89a6395d47","1/98",,"Gerard, Libby||Linn, Marcia C.||Madhok, Jacquie","2017-05-27T14:30:05Z","2017-03-21T12:05:42Z","2017-05-27T14:30:05Z","2017-03-21T12:05:42Z",,"2016-07","Automated guidance can facilitate student revision of explanations and arguments in online inquiry science units. We explore ways to design guidance for short essays that promotes meaningful revision rather than superficial changes. Specifically we compare the affordances of annotation of a fictional essay to knowledge integration guidance on revision of science writing. 293 middle-school students were randomly assigned to condition. Students who annotated an essay made significantly greater pre to post test gains and were also better able to use automated guidance on a posttest item than students who only received knowledge integration guidance. These findings suggest ways to support students to revise science writ-ing and build integrated understanding of science.","Made available in DSpace on 2017-05-27T14:30:05Z (GMT). No. of bitstreams: 1
52.pdf: 475794 bytes, checksum: 958e114747312d09a7a0f171096627d3 (MD5)
  Previous issue date: 2016-07","Gerard, L., Linn, M. C., & Madhok, J. (2016). Examining the Impacts of Annotation and Automated Guidance on Essay Revision and Science Learning In Looi, C. K., Polman, J. L., Cress, U., and Reimann, P. (Eds.). Transforming Learning, Empowering Learners: The International Conference of the Learning Sciences (ICLS) 2016, Volume 1. Singapore: International Society of the Learning Sciences.","https://repository.isls.org/handle/1/141","https://dx.doi.org/10.22318/icls2016.52","en","Singapore: International Society of the Learning Sciences","Examining the Impacts of Annotation and Automated Guidance on Essay Revision and Science Learning","Book chapter"
"7a3f5f80-c641-406c-9497-bed48c5cac0b","1/98",,"Liu, Xinyang||Chen, Shu||Jin, Yinglian||Pei, Xinning||Zheng, Tainian||Xiao, Sihan","2017-05-27T14:30:06Z","2017-03-21T12:05:42Z","2017-05-27T14:30:06Z","2017-03-21T12:05:42Z",,"2016-07","Teachers constantly encounter various responses generated by students in the classroom. These responses, which can be regarded as instructional “resources” that have potential value for facilitating students’ deep learning, are not fully used in teachers’ everyday practice. By proposing the notion of “student-generated resources” (SGRs) and adopting a “resources use” rather than sociolinguistic perspective, this study investigates what SGRs are there in the classroom and how teachers process them. Based on classroom observations, we identify five types of SGRs. Following the “perceive–interpret–mobilize” processing flow, teachers demonstrate three processing results (utilize, feedback, and abandon). Further, we identify three approaches of teachers’ utilization of SGRs and five approaches of their feedback to SGRs. Our findings suggest that teachers tend to give feedback to SGRs rather than utilize them as resources. This study broadens theoretical landscape about classroom resources and helps teachers take full advantage of SGRs in empowering students’ learning.","Made available in DSpace on 2017-05-27T14:30:06Z (GMT). No. of bitstreams: 1
53.pdf: 426445 bytes, checksum: 5a9dffe691b9465859763b03884e94bd (MD5)
  Previous issue date: 2016-07","Liu, X., Chen, S., Jin, Y., Pei, X., Zheng, T., & Xiao, S. (2016). Understanding Middle School Teachers’ Processing of Student-Generated Resources in Science Classrooms In Looi, C. K., Polman, J. L., Cress, U., and Reimann, P. (Eds.). Transforming Learning, Empowering Learners: The International Conference of the Learning Sciences (ICLS) 2016, Volume 1. Singapore: International Society of the Learning Sciences.","https://repository.isls.org/handle/1/142","https://dx.doi.org/10.22318/icls2016.53","en","Singapore: International Society of the Learning Sciences","Understanding Middle School Teachers’ Processing of Student-Generated Resources in Science Classrooms","Book chapter"
"f1152a9f-cdfb-43c2-98f8-234b1c195a89","1/98",,"Portolese, Alisha||Markauskaite, Lina||Lai, Polly K.||Jacobson, Michael J.","2017-05-27T14:30:06Z","2017-03-21T12:05:42Z","2017-05-27T14:30:06Z","2017-03-21T12:05:42Z",,"2016-07","When students learn science in a computer-supported, collaborative, delayed-instruction environment, how does understanding (and misunderstanding) emerge? Are there patterns in the pivotal moments when emerging understanding turns for the better or worse? While components such as modeling software, delayed instruction methods such as productive failure, and analogical-encoding methods such as contrasting cases have all been shown effective at supporting deep learning in science, little is known about the micro-level mechanisms explaining how and why students might be more or less successful when working in an environment combining all three. This paper details our refinements of an innovative method for unpacking the micro-level mechanisms contributing to turning points in the successes and failures in collaborative understanding when learning science with computer modeling. In unpacking our methodology, we discuss work including Sanderson and Fisher’s (1994) exploratory sequential data analysis (ESDA) guidelines and the productive multivocality project (Suthers, 2013) to frame our approach.","Made available in DSpace on 2017-05-27T14:30:06Z (GMT). No. of bitstreams: 1
54.pdf: 319322 bytes, checksum: 6acd71e9688c1832d179f3e22d5121c2 (MD5)
  Previous issue date: 2016-07","Portolese, A., Markauskaite, L., Lai, P. K., & Jacobson, M. J. (2016). Analyzing Patterns of Emerging Understanding and Misunderstanding in Collaborative Science Learning:  A Method for Unpacking Critical Turning Points In Looi, C. K., Polman, J. L., Cress, U., and Reimann, P. (Eds.). Transforming Learning, Empowering Learners: The International Conference of the Learning Sciences (ICLS) 2016, Volume 1. Singapore: International Society of the Learning Sciences.","https://repository.isls.org/handle/1/143","https://dx.doi.org/10.22318/icls2016.54","en","Singapore: International Society of the Learning Sciences","Analyzing Patterns of Emerging Understanding and Misunderstanding in Collaborative Science Learning:  A Method for Unpacking Critical Turning Points","Book chapter"
"d357622d-e99a-466d-92ba-13aeeb908495","1/98",,"Tan, Edna||Barton, Angela Calabrese","2017-05-27T14:30:07Z","2017-03-21T12:05:42Z","2017-05-27T14:30:07Z","2017-03-21T12:05:42Z",,"2016-07","In response to the vast inequities minoritized youth experience in STEM, we investigate how minoritized youth imagine and author pathways towards becoming in STEM. Drawing from social practice theory, identity and mobiliites of learning, we investigate, through critical longitudinal ethnography, how youth hack a pathway in and through STEM as they remix and repurpose tools, practices, relationships and artifact within and across the STEM-related worlds in their lives. We present one case study to articulate how youth engaged in pathhacking identity work to both gain access and transform both the process and outcomes of STEM participation in both informal programs and school science. The process, salient factors and implications of pathhacking identity work are discussed.","Made available in DSpace on 2017-05-27T14:30:07Z (GMT). No. of bitstreams: 1
55.pdf: 268362 bytes, checksum: 20af88c69d4e76090223c7bb24477d92 (MD5)
  Previous issue date: 2016-07","Tan, E. & Barton, A. C. (2016). Hacking a Path In and Through STEM: Unpacking the STEM Identity Work of Historically Underrepresented Youth in STEM In Looi, C. K., Polman, J. L., Cress, U., and Reimann, P. (Eds.). Transforming Learning, Empowering Learners: The International Conference of the Learning Sciences (ICLS) 2016, Volume 1. Singapore: International Society of the Learning Sciences.","https://repository.isls.org/handle/1/144","https://dx.doi.org/10.22318/icls2016.55","en","Singapore: International Society of the Learning Sciences","Hacking a Path In and Through STEM: Unpacking the STEM Identity Work of Historically Underrepresented Youth in STEM","Book chapter"
"f53a3f8b-974a-4dec-9110-ce8b57941a81","1/98",,"Collier, Wesley||Ruis, Andrew||Shaffer, David Williamson","2017-05-27T14:30:08Z","2017-03-21T12:05:42Z","2017-05-27T14:30:08Z","2017-03-21T12:05:42Z",,"2016-07","This paper examines techniques for modeling relationships among domain concepts and practices in discourse to assess learning in a CSCL environment. We compare two approaches: a traditional psychometric approach, which models the global correlation structure of student discourse markers across the learning intervention, and a model that accounts for the local correlation structure of discourse markers within activities. We investigate whether: (a) analysis of local correlation structure can identify significant differences between novices and relative experts; (b) these differences reflect meaningful differences the discourse; and (c) analysis of global correlation structure can identify significant differences between novices and relative experts. We assess whether an approach that models local relationships among concepts in a domain provides useful information beyond what might be extracted from a more traditional modeling approach. Our results indicate that techniques that account for local correlation structure can identify patterns in discourse not reflected in global correlation structure.","Made available in DSpace on 2017-05-27T14:30:08Z (GMT). No. of bitstreams: 1
56.pdf: 410629 bytes, checksum: 462a9d2407b7be5e6a9445ea56932366 (MD5)
  Previous issue date: 2016-07","Collier, W., Ruis, A., & Shaffer, D. W. (2016). Local Versus Global Connection Making in Discourse In Looi, C. K., Polman, J. L., Cress, U., and Reimann, P. (Eds.). Transforming Learning, Empowering Learners: The International Conference of the Learning Sciences (ICLS) 2016, Volume 1. Singapore: International Society of the Learning Sciences.","https://repository.isls.org/handle/1/145","https://dx.doi.org/10.22318/icls2016.56","en","Singapore: International Society of the Learning Sciences","Local Versus Global Connection Making in Discourse","Book chapter"
"6c691144-f387-44c9-9faf-60e08bb47e16","1/98",,"Andrade, Alejandro||Santo, Rafi","2017-05-27T14:30:09Z","2017-03-21T12:05:42Z","2017-05-27T14:30:09Z","2017-03-21T12:05:42Z",,"2016-07","We propose a distinctive method, Situated Action Networks (SANs), rooted in socio-cultural theories of learning that affords visualization and analysis of learning in a way that is theoretically robust yet scalable to large data sets. While visualization is increasingly looked to as a key means of understanding learning, there are few tools at learning scientists’ disposal that are simultaneously scalable yet also aligned with sociocultural perspectives. Situated Action Networks attempt to address this by appropriating techniques from social network analysis while aligning them with Cultural Historical Activity Theory. They accomplish this by (1) elevating learning activities to the forefront of learning visualizations, allowing for rich qualitative analyses of learning and (2) creating theoretically aligned indices that afford quantitative analyses within and across learning environments. Using data on collaborative learning dynamics between informal learning organizations as they engage in joint projects, we show the affordances of this method for understanding learning.","Made available in DSpace on 2017-05-27T14:30:09Z (GMT). No. of bitstreams: 1
57.pdf: 471803 bytes, checksum: eeacf66d6308033c3817fd3c6b5e6b60 (MD5)
  Previous issue date: 2016-07","Andrade, A. & Santo, R. (2016). Advancing Learning Visualizations: Situated Action Networks as Scalable Representations of Learning in Social Settings In Looi, C. K., Polman, J. L., Cress, U., and Reimann, P. (Eds.). Transforming Learning, Empowering Learners: The International Conference of the Learning Sciences (ICLS) 2016, Volume 1. Singapore: International Society of the Learning Sciences.","https://repository.isls.org/handle/1/146","https://dx.doi.org/10.22318/icls2016.57","en","Singapore: International Society of the Learning Sciences","Advancing Learning Visualizations: Situated Action Networks as Scalable Representations of Learning in Social Settings","Book chapter"
"4465e276-fb95-4b15-9b9a-63bb03dcf956","1/98",,"Allen, Carrie D.||Eisenhart, Margaret","2017-05-27T14:30:10Z","2017-03-21T12:05:42Z","2017-05-27T14:30:10Z","2017-03-21T12:05:42Z",,"2016-07","In this paper, we investigate how the national narrative of increasing opportunities for and broadening participation of young women of color in STEM was taken up locally at one racially-diverse, urban high school. Using ethnographic and longitudinal data, we focus on two young women of color as they negotiated and maintained STEM-related identities in the discursive and practice contexts of their lives at school. Using Holland and Lave’s concept of history-in-person (2001), we view the young women as fighting for particular versions of a future self, while entangled in discursive and social relations that threatened to position them differently than they wished to be. Our findings suggest a need for an explicit naming and examination of the “double bind” that young women of color experience as they move through school environments and special support to prepare them for the challenges they may face in STEM-related college programs or workplaces.","Made available in DSpace on 2017-05-27T14:30:10Z (GMT). No. of bitstreams: 1
58.pdf: 247910 bytes, checksum: 1d52926e1a2a7ed0fa4e11ab3f66e809 (MD5)
  Previous issue date: 2016-07","Allen, C. D. & Eisenhart, M. (2016). Fighting for Desired Versions of a Future Self: Young African American Women's STEM-related Identity Negotiations in High School In Looi, C. K., Polman, J. L., Cress, U., and Reimann, P. (Eds.). Transforming Learning, Empowering Learners: The International Conference of the Learning Sciences (ICLS) 2016, Volume 1. Singapore: International Society of the Learning Sciences.","https://repository.isls.org/handle/1/147","https://dx.doi.org/10.22318/icls2016.58","en","Singapore: International Society of the Learning Sciences","Fighting for Desired Versions of a Future Self: Young African American Women's STEM-related Identity Negotiations in High School","Book chapter"
